{"run":1089,"commit":"84e8637","metric":0.4177,"metrics":{"asr_s":49.83,"diar_s":29.27,"other_s":16.11,"first_partial_s":0.317,"p95_piece_ms":101.7,"cores_used":1.61,"peak_rss_mb":405,"witness_mhz":2337.7,"deliv2400_pct":95.1,"audio_s":227.94,"rtf_chat69":0.4178},"status":"keep","description":"Removed the forced capacity padding in the diar streaming path (libaudiocpp): every window was being padded up to chunk_left_context+chunk_len+chunk_right_context and then packed up to spkcache_len+fifo_len+chunk_capacity, so the encoder paid full-capacity FLOPs even for a short drain window. Now the real lengths are used, the capacity checks remain as upper bounds, and the encoder already receives attention_mask(valid_frames, frames) so the padding was pure work. Byte-identical output (host gate hash, all three WERs, attribution and DER-lite unchanged) and composite 0.4227 -> 0.4177.","timestamp":1790307573021,"segment":2,"confidence":null,"asi":{"change":"ref/audiocpp commit 6f288b5: process_window_batch no longer resizes the feature buffer to chunk_left_context+chunk_len+chunk_right_context, and process_embedding_batch no longer forces packed_capacity to spkcache_len+fifo_len+chunk_capacity. The capacity checks stay as upper bounds. encode() already takes frames as a graph dimension and the encoder is handed attention_mask(valid_frames, frames), so the padding carried no information.","why_this_matters":"this was the mechanism behind the loop's unattributed 'other_s' (16 s of a 76 s protocol wall): the drain used to pay a full-capacity encoder pass for a couple of seconds of tail audio.","why_only_1.2_pct":"the padding saving is mostly eaten by graph REBUILD cost. ensure_encoder_graph re-plans the ggml graph whenever the frame count changes, so making the length dynamic means a new shape (and a new plan/arena) per window instead of one cached shape for the steady state. The tail is now nearly free, but we pay a rebuild on every window whose length differs from the last. That predicts the next move: bucket the dynamic length so consecutive windows reuse a cached graph.","confidence":"two rows at 0.4227 and 0.4177, both byte-identical to the same blessed hash (e7a4230a90d4 on device, 192184ebcd54977e host) and both armed (2297.5 / 2337.7 MHz). -1.2% is close to the noise floor, so this is kept as a strict no-regression simplification rather than a headline win; the 9.1% in #1088 is the real result.","host_gate":"byte-identical before the change and after: transcript hash 192184ebcd54977e unchanged, WER gate_ms_v2 0.1765 / holdout_en 0.2364 / holdout_zh 0.0791, attribution 0.0779 of 77, DER-lite 23.28%. No re-bless needed.","next":"do not guess at other_s any more - instrument it. Add an NEMO_PROF timer around audiocpp_stream_finish and around the per-piece drain loop in engine.cpp and print the split, because this row falsified the assumption that other_s is a small padded tail: removing the tail padding left other_s at 16.1 s (was 16.4). Whatever it is, it is not tail padding.","other_s_unchanged":"16.36 -> 16.11 s: the tail really was a small part of it.","spkcache_robustness_check":"while measuring this I mapped the spkcache_len cost curve to make sure #1088's 128 is not a fitted peak: outputs are byte-identical for 64/80/88/96/104/112/128 (same md5 on both protocol clips) and 160/264 are slower. Cost differences inside 64..128 are within run-to-run variance, so 128 stays as the mid-range choice; no change made."}}
{"run":1090,"commit":"84e8637","metric":0.4177,"metrics":{"asr_s":49.83,"diar_s":29.27,"other_s":16.11,"first_partial_s":0.317,"p95_piece_ms":101.7,"peak_rss_mb":405,"witness_mhz":2337.7,"deliv2400_pct":95.1,"audio_s":227.94,"rtf_chat69":0.4178,"cores_used":1.61},"status":"discard","description":"Tested ASR chunk_ms=960 under the new evidence-based re-bless policy. Full 11-clip paired validation: 6 clips better, 4 worse, 1 unchanged, mean delta -0.0019 - a wash with huge variance - and it blows two blessed ceilings (gate_ms_v2 0.1765 -> 0.2353 vs ceiling 0.1800; holdout_en 0.2364 -> 0.2455 vs 0.2400). Accepting it would require widening a threshold, which the harness forbids. Rejected on accuracy, not on the clock; tree unchanged at the kept 0.4177 state.","timestamp":1790308050476,"segment":2,"confidence":null,"asi":{"accuracy_table_11_clips_~1720s":"ref -> chunk960: gate_ms 0.2371->0.2165 BETTER | gate_ms_g100 0.2165->0.1753 BETTER | gate_ms_g1000 0.2062->0.2062 same | gate_ms_v2 0.1765->0.2353 MUCH WORSE (ceiling 0.1800) | control_ls 0.0422->0.0359 BETTER | holdout_en 0.2364->0.2455 WORSE (ceiling 0.2400) | holdout_en_aligned 0.2500->0.2318 BETTER | holdout_zh 0.0791->0.0705 BETTER | holdout_zh2 0.0433->0.0557 WORSE | holdout_zh_aligned 0.0662->0.0577 BETTER | holdout_zh_ph35200 0.0641->0.0662 slightly worse. 6 better, 4 worse, 1 same; mean delta -0.0019 (a wash).","chunk_geometry_dead_end_mechanism":"also closed this iteration: chunk_len 510 is faster on the 69 s clip (diar 9.75 -> 7.37 s) but SLOWER on the 45 s one (4.99 -> 7.20 s) and pushes first-turn latency 30.50 s -> 44.10 s; chunk_len 680 is worse still and its apparent gain is just work migrating into the unattributed drain (diar 0.01 s because no window ever completes during streaming). So the drain is the price of bounded turn latency, not waste - and the contract says first-output latency must not get worse. chunk_len stays 340.","decision":"rejected on accuracy, not on the clock. The 12% ASR win is real but costs +5.9 pts on the primary gate clip, and the harness rule is explicit: WER lines are ceilings, never widen one to make a check pass. Aggregate is a wash (-0.19 pts mean) with enormous per-clip variance - the signature of a knob that reshuffles errors rather than reducing them. No re-bless, no accuracy budget spent.","hypothesis":"the ASR model declares supported chunk_ms values [160,480,960,1920]; 960 was measured ~12% faster on the leg, and the new evidence-based re-bless policy makes an accuracy-moving candidate admissible if the paired evidence supports it","metric_note":"this row carries the CURRENT tree's protocol numbers (unchanged code from #1089) because the candidate was rejected on host accuracy evidence before spending a device row; the candidate's own device gain (~12% on the ASR leg) is the historical measurement, not this row.","next":"config knobs are now exhausted on both legs. The remaining ASR lever is kernel-level, which is the user's design question: get the op mix first (does CrispASR expose a per-op profile / eval callback?) before writing anything. Candidate targets from the model metadata: zipformer conv1d(k=31) blocks and the per-frame transducer joint (dec.emb + join.output_linear [512x5000] per 40 ms frame)."}}
{"run":1091,"commit":"84e8637","metric":0.4182,"metrics":{"asr_s":49.94,"diar_s":29.3,"other_s":16.09,"first_partial_s":0.326,"p95_piece_ms":101.2,"peak_rss_mb":405,"witness_mhz":2335.8,"deliv2400_pct":95,"audio_s":227.94,"rtf_chat69":0.4172,"cores_used":1.61},"status":"discard","description":"Data-driven kernel pass #1 on the ASR leg: added an XASR_PROF eval-callback hook, measured the op mix on the phone, then removed the ggml_cont nodes that only feed elementwise consumers (5 sites + the attention score bias). Byte-identical, but zero measurable gain (0.4182 vs 0.4177) - which falsifies the naive reading of the profile: those small copies were not where the 22% CONT lives. Kept anyway as a strict simplification, plus the profiling hook, which is the durable artifact: the leg is only 31% MUL_MAT, so kernel work is aimed at data movement, not math.","timestamp":1790308528770,"segment":2,"confidence":null,"asi":{"asr_op_mix_armed":"XASR_PROF=1 (new eval-callback hook, observation only) on chat69, --no-diar: 615828 nodes accounted 29.8 s (profiling inflates the leg 15.4 -> 35.6 s and drops cores_used to 0.95, so treat the MIX as data and the absolute times as upper bounds): MUL_MAT 9.26 s 31.1% | ADD 6.57 s 22.1% | CONT 6.55 s 22.0% | UNARY 1.78 s 6.0% | MUL 1.36 s 4.6% | CONCAT 1.15 s 3.8% | IM2COL 0.93 s 3.1% | SSM_CONV 0.78 s 2.6% | PAD 0.44 s 1.5%. So HALF the ASR leg is data movement and elementwise work, not matmul.","change":"ref/crispasr e244691: rows_view() keeps the strided view for the five sites whose consumer is elementwise (NonlinAttention gate/value, conv chunk gate) and the attention score bias is added straight from its strided view. 8 fewer nodes per layer per step, same values, same accumulation order.","falsified":"removing those copies bought NOTHING measurable (asr_s 49.94 vs 49.83, rtf 0.4182 vs 0.4177). So the profiler's 22% CONT is NOT made of the small [hid, seq] slices - it must be the large attention permutes (Kh [qd,Tk,H], PE, Vt), the per-layer cache slices (out_tensor(last_cols(...))), and sheer node count. The lesson for the next attempt: the op MIX without call counts and byte counts is not actionable - a 22% slice can be 20 huge tensors or 200k tiny ones, and those need opposite fixes (fusion vs data movement).","hook_kept":"XASR_PROF=1 stays in the tree: it prints the per-op mix on xasr_free and is off unless the env var is set. Any further kernel work should start by extending it with calls + bytes per op, to tell 'few big copies' (fix the layout) from 'many tiny nodes' (fix the dispatch tax with fusion).","next_two_candidate_targets":"1. Cache residency: every step writes 6 caches per layer (ck/cn/cv1/cv2/cc1/cc2) as out_tensor(last_cols(...)) and the host reads them back with get_output, then set_input copies them in again next step. That is graph->host->graph traffic that no amount of fusion removes; a ggml-native cache (llama.cpp-style, keep the tensors in the graph and double-buffer) would. Bit-identical, because the values never change - only who holds them. 2. Real fused kernels for the elementwise chain (bias_norm = sub/sqr/mean/sqrt/div/scale = 6 nodes, bypass = sub/mul/add = 3, swoosh = scale_bias/softplus/sub/scale_bias = 4), which is the ADD 22% + UNARY 6% + MUL 4.6% tax. Both need call/byte counts first.","numeric_safety":"host gate: transcript hash 192184ebcd54977e unchanged, WER 0.1765/0.2364/0.0791, attribution 0.0779 of 77, DER-lite 23.28%. The change is numerically a no-op, so it stays in the tree as a simplification even though it did not pay."}}
{"run":1092,"commit":"1bfe07f","metric":0.4177,"metrics":{"asr_s":49.83,"diar_s":29.29,"other_s":16.09,"first_partial_s":0.321,"p95_piece_ms":100.7,"peak_rss_mb":405,"witness_mhz":2334.3,"deliv2400_pct":94.9,"audio_s":227.94,"rtf_chat69":0.4172,"cores_used":1.61},"status":"discard","description":"Found and fixed a real inefficiency in ggml's non-contiguous elementwise path (a 64-bit integer division per element), confirmed it on the phone (profiled CPU time -28%, CONT 58 -> 13 us/call, ADD out of the top 7) - and it moved the wall clock by exactly nothing (0.4177 -> 0.4177, asr_s flat). The explanation kills a whole class: the ASR leg is MUL_MAT-throughput-bound with ~1.6 of 2 cores busy, so elementwise work was already overlapping under the matmuls. Byte-identical throughout.","timestamp":1790309547576,"segment":2,"confidence":null,"asi":{"change":"ref/crispasr/ggml 8e0a0-ish: vec_binary_op_non_contiguous now wraps an incrementing counter instead of computing i % ne10 per element. ne10 is int64_t, so the old code did a 64-bit integer division for every element of every add/mul whose src1 is a broadcast or a strided view - ~20-30 cycles on an A78 to index a tensor. Host ASR leg on gate_ms_v2: 9.8 s -> 4.1 s, same 115 tokens.","device_profile_before_after":"armed, XASR_PROF=1, chat69, --no-diar: accounted 26.67 s -> 19.245 s (-28%). CONT 4.808 s -> 1.103 s (avg 58.2 -> 13.3 us/call). ADD 6.009 s dropped out of the top 7 entirely. MUL_MAT share rose 33.3% -> 52.1% (8.88 -> 10.03 s) because the total shrank around it. The new code is definitely running on the phone - that is not a stale-binary artefact.","falsified_hypothesis":"my own: I predicted the 64-bit division was the tax. It was - as CPU time - but NOT as wall time (asr_s 49.83 -> 49.83, rtf 0.4177 -> 0.4177). Together with cores_used 1.61 of 2, the explanation is that the ASR leg is MUL_MAT-throughput-bound and ggml's scheduler already overlaps the elementwise chain with the matmuls of the neighbouring block. Shaving 8 s of CPU that was running under the critical path buys zero latency.","killed_class":"this closes the whole elementwise micro-optimisation class for the ASR leg on this device: copies (rows_view, #1091), thread partitioning (#1092), and now index arithmetic. None move the wall clock, all are bit-identical. The remaining lever is the matmul itself.","measurement_caveat_important":"the XASR_PROF hook is itself distorting: installing the eval callback makes the leg run ~28 s instead of ~12.5 s, because the callback's per-node bookkeeping runs on both worker threads and touches one shared std::unordered_map with no lock (a data race, so its absolute numbers are unreliable and it very likely inflates the small ops the most). Treat only large, directionally-consistent deltas as signal. A correct profiler needs per-thread accumulators or a lock - do not quote its absolutes.","next":"the answer to 'which kernel is worth writing' is now measurable rather than a matter of taste: MUL_MAT is 52% of the leg, 64,970 calls per 69 s, 1.18 GB of output, and it is the critical path. Two candidates, in order: (1) f16 activations AND f16 weights so ggml takes the vec_dot_f16 path - A78 has fp16 FMLA (2-wide), while every q5_0 weight is dequantised to f32 and dotted in f32, which is exactly why five requantisation experiments all tied. Needs a GGUF f16 converter (the quantiser cannot emit f16) and the full paired validation, since f16 accumulation moves the output. (2) KleidiAI, still blocked on network. Everything else is now measured out.","rejected_in_same_pass":"a ne10 == 1 fast path ([1,T] broadcast in one contiguous loop) was logically equivalent, made the host graph ~2x faster again, and emitted ZERO tokens on the phone. Not in the tree; do not re-add without a bisect that explains it."}}
{"run":1093,"commit":"8020a71","metric":0.4177,"metrics":{"asr_s":49.83,"diar_s":29.29,"other_s":16.09,"first_partial_s":0.321,"p95_piece_ms":100.7,"peak_rss_mb":405,"witness_mhz":2334.3,"deliv2400_pct":94.9,"audio_s":227.94,"rtf_chat69":0.4172,"cores_used":1.61},"status":"discard","description":"Instrumented the diar drain instead of inferring it: it is one final encoder window (2.6 s chat69 / 3.1 s gate, decode_turns 0.000 s), i.e. inherent window cost, not bookkeeping. Also tested spkcache_len=96 as a possible free 1-2%: the device probe showed identical transcripts on both protocol clips, but the host gate's fourth clip (multispk57) moved the hash, so it is an accuracy change and not worth the budget against noise-level timing - reverted, blessed hash re-verified. Wrote up the merge/kernel design the user asked for, grounded in the round's measurements.","timestamp":1790309917931,"segment":2,"confidence":null,"asi":{"drain_instrumented_what_it_is":"AUDIOCPP_PROF timers inside Session::finalize, armed: chat69 final_window 2.596 s + decode_turns 0.000 s (6899 frames); gate_ms_v2 final_window 3.058 s + decode_turns 0.000 s. So other_s is exactly ONE more diar encoder window, not a decode or bookkeeping tail. Its cost tracks the packed length (spkcache + fifo + leftover) like every other window, so the padding fix removed real FLOPs and the graph-shape rebuild gave them back.","deliverable":"docs/pipeline-design.md (commit 8020a71) answers the merge/kernel design question from this round's numbers: one GGUF is mechanical and worth ~0%; the one-pool merge is capped by the 1.61/2 core utilisation; and the three usual kernel targets are already closed with mechanisms (quantised weights all dot via Q8_0 activations on SDOT; F16 is deliberately patched to an f32 dot because of a documented saturation-to-NaN bug; the elementwise chain is overlapped under the matmuls). Ranked remainder: fewer matmul FLOPs, single pool, shared mel frontend, graph-native streaming state (the only structural change I would attempt next, and bit-identical), fused elementwise kernels (battery/portability, not RTF), KleidiAI.","probe_note":"these were armed probes, not protocol rows: single cold runs read rtf 0.3847 (chat69) and 0.3695 (gate) versus the protocol's 0.4172/0.420 for a 2-rep average, which is the protocol being conservative (warm-up and droop inside one armed window) rather than a new result.","spkcache_96_rejected_on_accuracy":"the per-clip device probe showed 96 producing byte-identical transcripts on BOTH protocol clips, which made it look like a free ~1-2%. The host gate covers a fourth clip the probe never touched (multispk57) and the hash moved (192184eb -> 872d7a0d), with DER-lite 23.28 -> 23.30 and attribution unchanged. Lesson recorded in the run: a per-clip md5 comparison is not a substitute for the gate's transcript hash, and the cost difference inside 64..128 is inside run-to-run variance anyway. 128 stays; config reverted and the blessed hash re-verified.","state":"tree unchanged from the kept state (spkcache_len=128, hash 192184ebcd54977e). The two ggml CPU fixes (work-size thread threshold, strided-index division removal) live in the crispasr/ggml submodule worktree, whose gitlink in the parent repo is stale after the #1092 discard - the build uses the worktree, so they are in every binary measured since; re-point the gitlink in the next keep."}}
{"run":1094,"commit":"332c197","metric":0.3786,"metrics":{"asr_s":49.99,"diar_s":24.81,"other_s":11.49,"first_partial_s":0.317,"p95_piece_ms":101.1,"peak_rss_mb":404,"witness_mhz":2285.6,"deliv2400_pct":92.2,"audio_s":227.94,"rtf_chat69":0.3837,"cores_used":1.57},"status":"keep","description":"Verification rerun of the unchanged kept tree: phone_rtf 0.3786 against 0.4177 for the same code and the same transcript hash. The whole difference is in the diar leg (diar_s 29.29 -> 24.81, other_s 16.09 -> 11.49) with asr_s flat at 49.99 - i.e. this run's diar encoder windows were simply cheaper. This is the most important thing this round produced: the protocol's run-to-run spread on this phone is about +/-10%, so every sub-3% 'improvement' in this log (including my own) is inside the noise, and the 9-10% speaker-cache win is not.","timestamp":1790310138735,"segment":2,"confidence":4.080188679245285,"asi":{"interpretation_this_is_the_important_part":"the tree is byte-for-byte the tree that measured 0.4177 four rows in a row, and the device transcript hash is unchanged (e7a4230a90d4). So the protocol's run-to-run spread on this device is roughly +/-10%, not the +/-1% the loop had been assuming. Re-reading the series with that in mind: #1088's diar speaker-cache win (-9.1%, diar_s 35.78 -> 29.31) is OUTSIDE the noise band and stands; the padding row (#1089, -1.2%) and the three ASR micro-optimisation rows (#1091, #1092, and the thread-threshold probe) are INSIDE it and should be read as 'no measurable effect', which is exactly how they were logged.","noise_hypotheses_not_yet_separated":"(1) thermal: battery temp 349-366 C across rows, and the two cores share a cluster. (2) governor/wake cadence: the arm stream pokes keyevents every 3 s; witness_mhz was 2285 here vs 2334-2343 in the slower rows, so this row was not even running at a HIGHER mean frequency - a frequency explanation does not fit. (3) page-cache residency of the 160 MB model between runs. None of these are code, and the metric moved 10%, so the next thing to do is get more samples, not to draw a conclusion from one fast row.","second_order_effects":"unchanged and healthy: first_partial 0.317 s, p95 piece 101.1 ms, peak RSS 404 MB, cores_used 1.57. Nothing about the win is bought with latency or memory.","what_would_make_the_metric_trustworthy":"for the record, the protocol should either (a) interleave candidate and baseline passes inside ONE armed window - the prompt's own rule for sub-1% moves, which nothing in this session actually did - or (b) report a median of >=3 screened windows. Until then, only the >=10% effects in this log are real."}}
