{"run":1095,"commit":"4004163","metric":0.3769,"metrics":{"asr_s":49.76,"diar_s":24.75,"other_s":11.4,"first_partial_s":0.319,"p95_piece_ms":100.7,"peak_rss_mb":404,"witness_mhz":2332.9,"deliv2400_pct":94.8,"audio_s":227.94,"rtf_chat69":0.3815,"cores_used":1.57},"status":"keep","description":"Cooldown verification: after 180 s of cooling (battery 356 -> 348), the same tree measures 0.3769 - within 0.5% of the previous 0.3786, against 0.4177 for the four consecutive hot rows. Confirms the 10% protocol spread is the phone's thermal state, with the diar leg (memory-movement-bound) far more sensitive to it than the matmul-bound ASR leg. Establishes the honest current number: ~0.377-0.379 cool, ~0.418 hot, versus a 0.4651-0.47 baseline.","timestamp":1790310522441,"segment":2,"confidence":2.0801886792452833,"asi":{"confirms_thermal_hypothesis":"the fast regime reproduces: 0.3786 then, after a 180 s cooldown (battery 356 -> 348), 0.3769 - a 0.5% spread between two cooled runs, against 0.4177 for four consecutive hot runs. So the phone's thermal state, not the code, was worth ~10%, and the diar leg is the sensitive part (diar_s 24.75-24.81 cold vs 29.29 hot; asr_s is stable at 49.8-50.0 either way, which fits a matmul-bound leg that is less thermal-sensitive than a memory-movement-bound one).","corrected_reading_of_the_session":"honest current state: composite ~0.377-0.379 when cool, ~0.418 when hot, against a 0.4651/0.47 baseline that was itself measured hot. The speaker-cache win (#1088) is real at -9% and survives either regime. Nothing else in this log clears the noise floor.","harness_consequence_for_resuming_agents":"measure.sh does not cool the phone, and the loop ran rows back-to-back, so any future row is comparable only to rows taken at a similar thermal state. The cheap fix is to sleep ~180 s before arming (two cooled rows differ by 0.5%), or to interleave candidate and baseline in one window. Until someone does that, treat +/-10% as the row-to-row band and do not chase sub-3% deltas.","next":"the user's follow-up asks for a REAL merge of the two models, not just a design note. Plan: (1) write a single GGUF carrying both models with per-model name prefixes and merged metadata, (2) teach CrispASR's loader an optional tensor/KV prefix so it can read its half out of the shared file, (3) prove both engines load from that one file and the transcripts stay byte-identical, (4) measure load/RSS/page-cache effect, which is expected to be neutral and should be reported as such rather than dressed up as a speedup, (5) then use the same op-mix technique that paid off on the ASR leg to measure what a ONE-RUNTIME merge would have to beat in the diar encoder."}}
{"run":1096,"commit":"0bd9a55","metric":0.3775,"metrics":{"asr_s":49.76,"diar_s":24.92,"other_s":11.37,"first_partial_s":0.316,"p95_piece_ms":100.6,"peak_rss_mb":405,"witness_mhz":2339.8,"deliv2400_pct":95.2,"audio_s":227.94,"rtf_chat69":0.3825,"cores_used":1.57},"status":"discard","description":"REAL merge of the two models into one GGUF, end to end and measured. tools/merge_gguf.py writes a single 262.1 MiB file (1328 tensors: diar native + ASR under 'asr.'; 40 KV entries) with every payload byte-identical to the sources; crispasr's loader learned a tensor-name prefix (in the tensor lookup AND every metadata accessor - the second half is what makes it work at all); audiocpp accepts a logical-name list that prefixes the file's tensor list. --models-bundle points both engines at the one file. Correctness: the four gate clips reproduce the blessed hash 192184ebcd54977e exactly. Performance: neutral, as the arithmetic predicted - 0.3775 vs 0.3769/0.3786 for the two-file path in the same cooled regime, RSS 405 MB either way, load 0.12 -> 0.15 s. One file, one mmap, one artifact; not a speedup, and the default path stays two files.","timestamp":1790311443306,"segment":2,"confidence":2.039306358381504,"asi":{"capability_committed_not_rejected":"this row is DISCARDED in the metric sense only - the merge is not a failed experiment, it is infrastructure with a measured-neutral effect, and it is committed and working: nemo-x-asr-diarizer 0bd9a55 (tools/merge_gguf.py, --models-bundle, docs), crispasr c8064a5 (prefix-aware loaders), audiocpp e2ba2e0 (name list may prefix the tensor list). The working tree was clean at log time, so nothing was reverted. The DEFAULT path is still two files; the bundle is opt-in via --models-bundle or BUNDLE=1.","correctness_evidence":"host: the four gate clips run from the single bundle reproduce the blessed transcript hash 192184ebcd54977e EXACTLY, and validate.sh-class WERs hold (holdout_en 0.2364, holdout_zh 0.0791). Device: identical transcript hashes per clip (dd2a52fd chat69, db68a9da gate) in both modes, and this protocol row's HASH e7a4230a90d4 matches every two-file row. Byte-identical is the point: the bundle changes packaging, not arithmetic.","file_facts":"bundle.gguf = 274,868,096 bytes (262.1 MiB) vs 160,389,920 + 106,674,240 for the two files - i.e. the sum, no duplication. 1328 tensors: 362 diar native + 966 under 'asr.'; 40 KV entries. All 1328 payloads verified byte-identical to their sources by an independent re-parse.","hypothesis":"merge the two models into one GGUF so the composite ships and opens one artifact, and measure whether that buys anything","measurement":"armed, witness 2339.8 MHz / 95.2% at 2.4 GHz, BUNDLE=1. phone_rtf 0.3775, asr_s 49.76, diar_s 24.92, other_s 11.37, RSS 405 MB, first_partial 0.316 s, p95 piece 100.6 ms. The two-file path measured 0.3769 and 0.3786 in the same cooled regime - so the bundle is inside a 0.5% spread, i.e. neutral, and load time rose 0.12 -> 0.15 s for the single larger mmap.","next":"the interesting merge is still the one-runtime one, and its first prerequisite is now in place. Next step for it: measure the diar encoder's op mix with the same eval-callback technique that found the ASR's per-element division, so the port has a target profile instead of an assumption. The hard constraint remains the two ggml runtimes: the one-pool form is the only version of overlap that can pay, because the naive two-pool version lost 37-47%.","three_bugs_found_building_it":"all silent rather than loud, all worth remembering: (1) GGUF array elements must NOT repeat the type field - the array header declares the element type once, and writing one per element desynchronised the entire KV block (the diar metadata has arrays of strings, so it failed immediately); (2) tensor offsets are relative to the DATA SECTION, so using the file size for the last tensor inflates it by the header length, and because b'\\0' * negative is a no-op rather than an error, every subsequent tensor lands early while the file still parses; (3) a metadata helper that returns a DEFAULT on a miss turns 'wrong namespace' into 'corrupt model' - the first bundle attempt loaded the weights fine and failed with 'inconsistent hyper-parameters' because vocab_size resolved to 0, since only the tensor lookup had been made prefix-aware. Rule of thumb: in a merged-format loader, every lookup path needs the namespace, and defaults must never be silent."}}
{"run":1097,"commit":"2c60d2e","metric":0.3142,"metrics":{"asr_s":49.43,"diar_s":14.41,"other_s":7.77,"first_partial_s":0.315,"p95_piece_ms":101.1,"peak_rss_mb":404,"witness_mhz":2282.5,"deliv2400_pct":92,"audio_s":227.94,"rtf_chat69":0.3203,"cores_used":1.68},"status":"keep","description":"The biggest win of the session, found by instrumentation rather than theory. The AUDIOCPP_PROF phase timers (added for the one-runtime merge study) showed the 'model-bound' diar leg was 40% signal processing: mel frontend 4.52 s vs transformer encoder 6.61 s per 69 s clip. The cause: MelFilterbank::compute_custom walked all 128x257 filterbank weights per frame and accumulated in `long double`, which on ARM64 is software-emulated IEEE quad precision - libgcc calls, not FPU ops - while the diarizer's own bank has only 504 nonzero weights out of 32,896 (1.5%, 2.0 bins per mel). Skipping exactly-zero weights in the same frequency order is bit-identical. Frontend 4.518 -> 0.249 s (chat69) and 2.920 -> 0.153 s (gate), i.e. 18-19x on that phase; protocol diar_s 24.75 -> 14.41 s and other_s 11.40 -> 7.77 s; phone_rtf 0.3769 -> 0.3142 on a HOT row (battery 362), where the same tree had measured 0.4177-0.4227 earlier in the session.","timestamp":1790312143387,"segment":2,"confidence":3.653753026634383,"asi":{"biggest_win_of_the_session":"the whole session's biggest single win, and it came from instrumentation rather than theory. -33% against the 0.47 baseline, -16.6% against this morning's cooled 0.3769 - and it is BYTE-IDENTICAL (device hash e7a4230a90d4, host gate 192184ebcd54977e, WER 0.1765/0.2364/0.0791, attribution 0.0779 of 77, DER-lite 23.28%).","drain_also_improved":"other_s 11.40 -> 7.77 s: the drain is one final window and its frontend share went with everything else.","evidence_chain":"the AUDIOCPP_PROF phase timers I added for the one-runtime merge study are what found it: features 4.52 s vs encode 6.61 s vs pre_encode 0.02 s on chat69. A 'model-bound' leg was 40% signal processing. The structural op histogram of the encoder graph (1771 nodes/window, RESHAPE/MUL/ADD/VIEW/MUL_MAT) is now recorded for the port study.","findings_for_the_one_runtime_merge_study":"the diar leg after this fix is ~14.4 s per protocol run, of which the transformer encoder is ~6.6 s per 69 s clip and the frontend 0.25 s. So the encoder is back to being the dominant term, which is what a one-runtime port would have to beat - and the frontend result is a warning for that study: measure the phase split BEFORE assuming where a model-bound leg spends its time. Also note extract_mono takes its waveform BY VALUE, copying the window's audio on every call (small next to 4.5 s, but free to fix).","hypothesis":"the composite's 'model-bound' diar leg is not all model: instrument its phases and fix whatever is not","latency_and_memory_untouched":"first_partial 0.315 s (was 0.316-0.321), p95 piece 101.1 ms, peak RSS 404 MB. Nothing was traded for the speed.","mechanism":"MelFilterbank::compute_custom walked all 128 mels x 257 frequency bins for every frame and accumulated in long double, which on ARM64 is software-emulated IEEE quad precision (__multf3/__addtf3 calls, not FPU ops). The diarizer's own filterbank has 504 nonzero weights out of 32,896 - 1.5%, 2.0 bins per mel - so 98.5% of that arithmetic was multiplying and adding exact zeros. Visiting only the nonzero weights, in the same ascending-frequency order, is bit-identical: adding +0 to a finite partial sum is exact, and the only possible divergence is a sum of exactly zero, where -0.0 and +0.0 both feed the same log(x + 2^-24). The dense path is retained for genuinely dense banks so no other model is pessimised.","measurement":"armed, witness 2282.5 MHz / 92.0% at 2.4 GHz, and this was a HOT row (battery 362) - the same tree measured 0.3769 and 0.3786 after cooling, so the cooled expectation for this build is ~0.30. Per-leg: asr_s 49.43 (unchanged, as expected - the change is entirely in audiocpp's frontend), diar_s 24.75 -> 14.41, other_s 11.40 -> 7.77, cores_used 1.57 -> 1.68.","next":"the encoder is the diar leg again (6.6 s per 69 s clip) and the ASR leg is two thirds of the composite, so the remaining levers are back to kernels/fewer-FLOPs. But the lesson of this row generalises: instrument the phase split before theorising about any 'model-bound' leg, because a 128-bit scalar loop in a filterbank is not a model. Two cheap follow-ups worth an iteration each: (a) the frontend is now 0.25 s - check whether the remaining STFT/normalisation is worth attacking or is already small; (b) look for the same long-double / sparse-skip pattern elsewhere in audiocpp's DSP and feature code, since it is now proven to be worth real seconds on this device."}}
{"run":1098,"commit":"d692d13","metric":0.3084,"metrics":{"asr_s":47.9,"diar_s":14.64,"other_s":7.76,"first_partial_s":0.303,"p95_piece_ms":97.1,"peak_rss_mb":404,"witness_mhz":2312.2,"deliv2400_pct":93.4,"audio_s":227.94,"rtf_chat69":0.313,"cores_used":1.7},"status":"keep","description":"Build the x-asr chunk graph once instead of per decode step - which also fixes a latent use-after-free. build_chunk_graph() returned a graph whose ggml_context it had already freed (ggml allocates mem_buffer even with no_alloc=true), so the graph lived in freed memory through alloc/compute/get_output and only survived on allocation luck; and the ~4,000-node graph was rebuilt and re-allocated every step (143 builds for 145 steps on chat69). Now the context owns the graph, built and allocated once, with inputs rewritten per step - llama.cpp's reuse pattern - and the positional-encoding tables built once. Numerically a no-op: host gate byte-identical. asr_s 49.43 -> 47.90, p95 piece 101.1 -> 97.1 ms, first partial 0.315 -> 0.303 s, phone_rtf 0.3142 -> 0.3084.","timestamp":1790312582592,"segment":2,"confidence":3.5532879818594107,"asi":{"asr_leg_split_measured":"the phase timers give the honest picture for the first time: per 69 s clip, compute 19.2 s (with the eval callback's ~2x inflation) vs 1.3 s of host work - build 0.196, alloc 0.349, pos-enc 0.034, inputs 0.223, outputs 0.551, fbank 0.000. So the ASR leg really is ~93% ggml compute, the opposite of the diar leg where 40% was signal processing. That is why the elementwise micro-optimisations there moved nothing, and it is now measured rather than assumed.","latency_improved_too":"p95 piece 101.1 -> 97.1 ms and first partial 0.315 -> 0.303 s: the win is not bought with latency, it comes from doing less bookkeeping per piece.","latent_use_after_free_fixed":"worth stating plainly because it is a correctness fix, not an optimisation: build_chunk_graph() returned a ggml_cgraph whose ggml_context it had already freed. ggml allocates mem_buffer even when no_alloc=true, so the graph struct (and every node pointer in it) lived in freed memory for the whole of alloc_graph + compute + get_output. It only ever worked because the next ggml_init reused that exact block after the graph was done. The context is now owned by xasr_context and freed after the scheduler. Anyone porting this graph pattern elsewhere should not copy the old ownership.","measurement":"armed, witness 2312.2 MHz / 93.4% at 2.4 GHz, battery 357 - comparable thermal state to the previous row (2282.5 MHz, battery 362), so the delta is not a thermal artifact. asr_s 49.43 -> 47.90 (-3.1%), diar_s 14.64 (flat, untouched), other_s 7.76 (flat), cores_used 1.68 -> 1.70, RSS 404 MB unchanged.","method":"graph reuse across decode steps, the pattern llama.cpp uses across tokens of a streaming model: build once, ggml_backend_sched_reset + alloc_graph once, then per step only write inputs and compute. The positional-encoding tables (6 stages of sin/cos/atan per call) are built once for the same reason.","next":"both legs are now genuinely compute-bound in ggml (ASR ~93% compute; diar dominated by its transformer encoder at ~6.6 s per 69 s clip after the filterbank fix). The remaining measured host work is the cache round-trip (outputs 0.551 s + inputs 0.223 s per 69 s clip): 114 cache tensors per step go graph -> host vector -> graph, with a fresh allocation each time. Making that ggml-native (keep the cache tensors in the graph, double-buffered) is bit-identical in principle and is the last structural item on the ASR side; expect it to be worth ~0.7 s per clip, i.e. ~2%, and to be mostly off the critical path like the other host-side work - so measure before believing it."}}
{"run":1099,"commit":"767362d","metric":0.3073,"metrics":{"asr_s":47.73,"diar_s":14.59,"other_s":7.72,"first_partial_s":0.306,"p95_piece_ms":97.1,"peak_rss_mb":404,"witness_mhz":2199.4,"deliv2400_pct":87.1,"audio_s":227.94,"rtf_chat69":0.3123,"cores_used":1.7},"status":"discard","description":"Attacked the transducer joint network - a [5000x512] matvec per encoder frame in plain host C++, invisible to the ggml op profile, measured at 3.87 s per 69 s clip (31% of the ASR leg) - with two independent attacks, and kept neither. (1) Four independent NEON accumulators: 3.87 -> 3.84 s, and NEON is genuinely enabled in this build, so compute is not the limit. (2) Sharing one pass over the 10.2 MB joint matrix across a block of frames that share the decoder state (only ~78% of frames emit a token, so most consecutive frames have the same state): 3.87 -> 6.43 s, clearly worse. The gate also caught three separate bookkeeping bugs in the batching attempt (block advance by the shrinking length, per-block instead of per-frame token timestamps, and a frame counter that accumulates across calls), all now documented in the source. Tree reverted to the measured-best form with the negative results and the remaining route recorded: the matrix is streamed at ~4.5 GB/s with one use per element, so BYTES are the lever (f16/q8_0 joint weights), which changes logits and therefore needs the paired validation rather than the byte-identity gate.","timestamp":1790313755771,"segment":2,"confidence":3.3059071729957807,"asi":{"measurement":"armed, witness 2199.4 MHz / 87.1% at 2.4 GHz, battery 345 - a warm row, so this is if anything conservative. asr_s 47.73, diar_s 14.59, other_s 7.72, first_partial 0.306 s, p95 piece 97.1 ms, RSS 404 MB. Same tree as #1098 (asr_s 47.90) within noise; the point of this row is the reverted-but-documented state, not a new number.","negative_result_value":"this row exists to record a bounded negative so nobody re-runs it. The joint network is 3.87 s per 69 s clip = 31% of the ASR leg and it is NOT improvable by vectorising the arithmetic (NEON 4x accumulators: 3.84 s) nor by sharing weight passes across frames that share the decoder state (6.43 s, worse). What remains is reducing BYTES, because the matrix is streamed at ~4.5 GB/s with exactly one use per element: storing the joint weights as f16 (10.2 -> 5.1 MB) or q8_0 (-> 2.6 MB) should cut that phase by up to 2x/4x. That changes the logits, so it needs .auto/validate.sh and a deliberate re-bless, not the byte-identity gate. That is the single largest identified remaining item, and it is now scoped with a mechanism instead of a hunch.","next_actions_ranked":"1. f16 or q8_0 joint weights (est. -1.5 to -2.5 s per 69 s clip, i.e. -6 to -10% composite) - numerics-changing, so validate.sh (4 min host) then a re-bless decision. 2. The ggml-native cache round-trip on the ASR side (outputs 0.563 + inputs 0.278 s per clip, 114 cache tensors per step going graph -> host vector -> graph): bit-identical in principle, but every host-side phase so far has been partly hidden under the matmuls, so measure before believing ~2%. 3. Re-run the diar encoder profile now that the frontend is 18x faster, to see whether its 6.6 s per 69 s clip has a similar non-model component - the filterbank find says check before assuming.","safety":"the reverted state is byte-identical (gate hash 192184ebcd54977e) and the only code change kept is the greedy_s timer plus documentation. Nothing about the shipped decode path changed.","three_bookkeeping_traps_recorded_in_the_source":"the speculative-batching attempt failed the byte-identity gate three separate times before passing, each time for a different real reason, and all three are now documented in xasr.cpp: (1) advancing the block by the SHRINKING working length instead of the block's real length silently skips frames; (2) incrementing the frame counter per block instead of per frame gives every token in a block the same timestamp, which moves attribution from 0.0779 to 0.5455 of 77 without touching the text at all; (3) gs.frame_pos accumulates ACROSS calls, so the call's first frame is not index 0 - and enc is indexed from the call while token timestamps are global, so those two indices must be kept separate. None of these would have been visible in WER; the transcript-hash gate caught all three."}}
