{"type":"config","name":"Composite streaming ASR+diar RTF on phone CPU (taskset C0, armed), accuracy byte-identical","metricName":"phone_rtf","metricUnit":"","bestDirection":"lower"}
{"run":1081,"commit":"dade391","metric":0.4651,"metrics":{"asr_s":49.66,"diar_s":35.92,"other_s":20.44,"first_partial_s":0.315,"p95_piece_ms":101.3,"peak_rss_mb":412,"witness_mhz":2316.8,"deliv2400_pct":93.9,"audio_s":227.94,"rtf_chat69":0.4654},"status":"discard","description":"Attacked the ~8.5 s/stream diar drain: (a) diar-only trailing silence before stream_finish (0/2/4 s) - no effect on the drain, transcript unchanged; (b) skipping stream_finish entirely - saves the whole 8.5 s but changes the transcript (finish also closes the turn still open at end-of-audio), so it is a diarisation change, not a free speedup. Metric unchanged: both flags default to off and stay in the tree as diagnostics.","timestamp":1790293783615,"segment":2,"confidence":null,"asi":{"hypothesis":"the 20 s of other_s is a fixed cost inside audiocpp_stream_finish and can be avoided","mechanism_found":"NOT overhead. libaudiocpp instrumentation shows the final flush emits ONE window and process_stream_windows spends 8.76 s on it; every window has encoder_frames=188, a FIXED-SIZE encoder pass. The diar costs ~8.5 s per ~26 s window; 'other_s' was simply the last window landing outside the per-piece timers. Short clips pay a whole window for 3 s of audio (7.27 s), which is exactly why it looked like a constant.","probe_a":"diar-only trailing silence 0/2/4 s -> drain 8.77/8.97/9.19 s (no effect). Side fact: 2-4 s of trailing silence leaves the transcript byte-identical.","probe_b":"skip stream_finish -> drain 0.00, single-pass RTF 0.7849->0.5922 (gate) and 0.7824->0.6578 (chat69), but transcript hash changes on both clips (15/23 blocks either way) - the final decode closes the turn still open at end-of-audio. Rejected under byte-identity.","instrumentation_note":"incremental rebuild of libaudiocpp.so for arm64 is 4 s, not the 27 min a full configure costs; ref/audiocpp is a git checkout at fc24c99 so instrument-and-revert is safe and cheap. The instrumented .so must be pushed back out of the device - measure.sh now hash-pushes it.","real_lever":"the loop is sequential: push diar (blocks on an 8.5 s window every ~26 s of audio) then accept asr. asr 49.7 s + diar 35.9 s per 228 s of audio, on 2 cores, with the two engines sharing nothing. Overlapping the legs is worth up to min(asr, diar) ~ 36 s per 228 s = RTF 0.47 -> ~0.28 ideal, vs 0.4651 now.","next_action_hint":"drive the diarizer from a worker thread fed by a (offset,len) queue into wav.pcm; main thread does asr_stream_accept only; join before the final attribute pass. Output must stay deterministic because speaker tagging happens in the FINAL attribute pass from the complete turn list - verify that assumption holds before trusting the byte-identity result."}}
{"run":1082,"commit":"5a75605","metric":0.4651,"metrics":{"asr_s":49.66,"diar_s":35.92,"other_s":20.44,"first_partial_s":0.315,"p95_piece_ms":101.3,"peak_rss_mb":412,"witness_mhz":2316.8,"deliv2400_pct":93.9,"audio_s":227.94,"rtf_chat69":0.4654},"status":"discard","description":"Ran the diarizer on a worker thread so the two independent legs overlap instead of serialising (asr 49.7 s + diar 35.9 s per 228 s of audio). Rejected on the device: composite got 37-47% SLOWER. Metric reported as unchanged because the async path was reverted (commit daf62f7) and the shipped default path is the baseline tree.","timestamp":1790294618447,"segment":2,"confidence":null,"asi":{"hypothesis":"wall = asr + diar because the loop is sequential; overlapping the legs on the 2 A78s should approach max(asr, diar)","result":"strongly negative. Paired A/B in one armed window: gate_ms_v2 RTF 0.7848 -> 1.0743, chat69 0.7756 -> 1.1449. Both legs slowed about 2.8x (asr 24.87 -> 70.54 s, diar 20.26 -> 51.63 s) while total CPU work and peak RSS (412 MB) were unchanged.","transcripts":"byte-identical sync vs async (md5 db68a9da0e90 / 2929e3cfc15d) - the determinism argument held: tags come from the final attribute pass after joining the worker.","mechanism_best_explanation":"superlinear contention between two large streaming working sets (x-asr 168 MB + diar 106 MB) sharing the caches/DRAM bandwidth of the two A78s, plus 8 diar threads + 1 ASR thread on 2 cores. Not a spin-wait livelock, not the GPU path, not affinity (no --main-affinity was passed).","ruling":"sequential execution of the two legs is optimal on this device. Predicts any leg-concurrency variant loses; if a future change makes one leg much cheaper, re-test with the CHEAP leg overlapped rather than both.","next_action_hint":"structural win is elsewhere: the ASR leg reportedly runs on ONE thread (archive claim), i.e. 49.7 s of the 106 s wall occupies one core while the second core idles, and it cannot be hidden by overlap. Verify thread count on device (NEMO_DEBUG_THREADS prints it per piece) before attacking it.","revisits_run":1081}}
{"run":1083,"commit":"7b160db","metric":0.4651,"metrics":{"asr_s":49.57,"diar_s":35.78,"other_s":20.54,"first_partial_s":0.316,"p95_piece_ms":100.8,"cores_used":1.65,"peak_rss_mb":413,"witness_mhz":2304.5,"deliv2400_pct":93.1,"audio_s":227.94,"rtf_chat69":0.4631},"status":"discard","description":"Targeted retry of the leg-overlap dead end (#1082) with the assumption that caused the failure changed: the ASR leg at 1 thread (no 2-thread ggml barrier to spin on) and, in a second variant, each leg pinned to its own A78. Still a loss, so overlap is closed out. Metric is the unchanged baseline because the async path was reverted again.","timestamp":1790297220207,"segment":2,"confidence":null,"asi":{"hypothesis":"#1082's 2.8x loss came from a spinning 2-thread ggml barrier competing with diar threads; with ASR at 1 thread the overlap should pay off","changed_assumption":"ASR threads 2 -> 1, and a second variant pinned legs to separate cores (mask 0x40 / 0x80 inside the C0 pinning)","paired_chat69_rtf":"A sync t=2 0.7773 (reference) | B sync t=1 1.1628 | C async t=1 0.8839 | D async t=1 + per-leg affinity 0.8831 | E async t=2 1.1291","transcripts":"byte-identical in all five variants (2929e3cfc15d)","verdict":"spin-waiting was NOT the mechanism: async with ASR at 1 thread is still 14% worse than sync. Per-leg affinity changed nothing (0.8839 vs 0.8831) - the --main-affinity/--engine-affinity knobs appear to have no measurable effect at all, which is its own open question.","also_learned":"thread scaling is real for both legs: ASR-only chat69 wall 34.83 s at t=1 vs 24.74 s at t=2; diar 31.45 s at t=1 vs 20.44 s at t=2. The -t flag sets BOTH legs' thread counts (bc.threads for audio.cpp, p.n_threads for CrispASR), so 'threads' is not an ASR-only knob today.","build_flags_ruled_out":"dotprod already enabled: -mcpu=cortex-a78 implies +dotprod, and the shipped libggml and a forced -DGGML_CPU_ARM_ARCH=armv8.2-a+dotprod+fp16 build contain the SAME 1050+ dotprod instructions. ggml's check_cxx_source_runs probe can never pass when cross-compiling, so the CMake log is misleading, not the binary.","next_action_hint":"structural levers exhausted at this model/quantisation. Remaining: (1) prefault the two models at init and check honestly whether it moves work or removes it (measure init_s, not just run wall); (2) KleidiAI matmul backend (build flag, unlikely byte-identical); (3) accept the sequential floor ~0.465.","revisits_run":1082}}
{"run":1084,"commit":"7b160db","metric":0.4651,"metrics":{"asr_s":49.57,"diar_s":35.78,"other_s":20.54,"first_partial_s":0.316,"p95_piece_ms":100.8,"cores_used":1.65,"peak_rss_mb":413,"witness_mhz":2304.5,"deliv2400_pct":93.1,"audio_s":227.94,"rtf_chat69":0.4631},"status":"discard","description":"Diar streaming geometry sweep in the *other* direction (chunk_len 510/1020 vs the shipped very_high 340, right context scaled to keep the same overhead ratio). Aggregate is a wash - chat69 -4%, gate_ms_v2 +13% - and the transcript stops being byte-identical on chat69, so it is not admissible. New --diar-session-opt / --diar-opt plumbing kept.","timestamp":1790298450190,"segment":2,"confidence":null,"asi":{"hypothesis":"the diar pass costs a fixed ~7 s because the AOS cell's work is the 264-frame speaker cache, not the chunk frames - so FEWER, LARGER chunks should cut the leg","changed_assumption":"#1081 measured smaller chunks; this one tests the opposite direction (chunk_len 510/60 and 1020/120 vs the shipped very_high 340/40)","paired_device":"gate_ms_v2: base 0.7880 (diar 10.33) | 510 0.8914 | 1020 0.8838 - with diar_s collapsing to 0.01 because the whole clip becomes one window that stream_finish pays for. chat69: base 0.7798 (diar 20.44) | 510 0.7475 (diar 14.37) | 1020 0.7507.","accuracy":"NOT byte-identical: chat69 transcript hash changes (2929e3cfc1 -> 2d74b104da at 510, -> 2b99dfc4d6 at 1020) while gate_ms_v2 stays db68a9da0e. Chunk geometry is inert on a 45 s single-window clip and changes speaker tags on a 69 s multi-window one.","verdict":"rejected: aggregate is a wash (one clip better, one worse) and it violates byte-identity, which would cost a full paired re-validation for a ~0% gain.","also":"found nemotron_3_diar.latency_profile and its session-scoped geometry options (chunk_len/chunk_right_context/fifo_len/spkcache_len/spkcache_update_period in 80 ms encoder frames, graph_arena_mb, weight_context_mb, weight_type). They are SESSION options: setting them on a request fails with 'unknown Nemotron 3 diarization request option'. Added --diar-session-opt K=V for them, and --diar-opt K=V for the request-scoped speaker_* knobs.","stride_note":"chunk_len 340 encoder frames = 27.2 s of audio at 80 ms/frame, which is the window length inferred independently from the timing.","next_action_hint":"try the memory-sizing session options (graph_arena_mb, weight_context_mb default 1024 MiB each against a 413 MB peak RSS) - numerically inert by construction, so if they move the clock they are free.","revisits_run":1081}}
{"run":1085,"commit":"5ca6c42","metric":0.4651,"metrics":{"asr_s":49.57,"diar_s":35.78,"other_s":20.54,"first_partial_s":0.316,"p95_piece_ms":100.8,"cores_used":1.65,"peak_rss_mb":413,"witness_mhz":2304.5,"deliv2400_pct":93.1,"audio_s":227.94,"rtf_chat69":0.4631},"status":"discard","description":"Prefault both models at init (charged to load_s, which is now printed) to test whether first-pass page faults inside the measured window cost anything. Net effect on the phone is zero: load grows by what wall shrinks. Metric is the unchanged baseline; the diagnostic and the load_s print stay in the tree.","timestamp":1790299282684,"segment":2,"confidence":null,"asi":{"hypothesis":"the measured window hides minor page faults on 274 MB of mmapped weights; touching them at init removes that cost","result":"it is a shift, not a win. Armed paired device runs: gate_ms_v2 wall 35.37 -> 35.24 s while load 0.20 -> 0.32 s (net +0.01 s); chat69 wall 53.96 -> 53.67 s with the same +0.12 s of load (net -0.17 s, inside noise).","surprise":"Engine::init is only 0.20 s on the phone - model load is essentially free (mmap + warm page cache). Any 'prefault the models' or 'first-window premium' theory is dead: there is no multi-second load cost to hide anywhere, unlike the 1.5B baseline's measured ~130 ms first-window premium.","accounting_note":"added load_s to [stats] precisely so this class of change cannot masquerade as a speedup: judge load_s + wall_s, never wall_s alone.","next_action_hint":"decompose the ASR leg by CONTENT instead of audio length: two clips give asr ~0.099 s per audio-second PLUS ~0.047 s per emitted token (solve the 2x2 from gate 9.8 s/45 s/115 tokens and chat69 24.9 s/69 s/388 tokens). If the token term is really the RNN-T decoder running per 40 ms emission it is irreducible; if it is per-accept text reconstruction it is library overhead worth reporting upstream.","transcripts":"unchanged (f5d56f9171d0 host; device hashes unchanged) - the prefault reads files only"}}
{"run":1086,"commit":"ec3dd2f","metric":0.4651,"metrics":{"asr_s":49.57,"diar_s":35.78,"other_s":20.54,"first_partial_s":0.316,"p95_piece_ms":100.8,"cores_used":1.65,"peak_rss_mb":413,"witness_mhz":2304.5,"deliv2400_pct":93.1,"audio_s":227.94,"rtf_chat69":0.4631},"status":"discard","description":"Diagnostic row, no code change to the measured path: armed and screened sum-of-parts floor. Composite 31.83 s vs asr-alone 15.43 + diar-alone 16.89 = 32.32 s on chat69 (witness 2350 MHz) - sequential execution is already at the floor, so no scheduling lever remains.","timestamp":1790299881607,"segment":2,"confidence":null,"asi":{"hypothesis":"establish the floor: with both legs armed and screened, does the composite differ from the sum of the isolated legs?","armed_screened_chat69":"asr alone (--no-diar) 15.43 s = 0.2236 s/audio-s | diar alone (--no-asr) 16.89 s = 0.2448 | composite 31.83 s = 0.4613 | sum of parts 32.32 s. Witness 2350.7 MHz, 95.7% of time at >=2.4 GHz.","finding":"composite = asr_alone + diar_alone, to within 1.5% (and the composite is the FASTER of the two). Two processes' worth of model work in one process, sequentially, costs nothing extra and buys nothing back. There is no structural headroom left: the RTF is the arithmetic sum of two model-bound legs, 0.224 + 0.245.","consistency":"asr-alone armed 0.2236 matches the composite's asr_s/audio = 49.57/227.94 = 0.2175, and diar-alone 0.2448 matches diar_s+other_s = (35.78+20.54)/227.94 = 0.247. Every earlier number now reconciles - the 0.36 s/audio-s I kept seeing in probes was 1.3 GHz, not a different code path.","methodology_bug_found":"my probes called .auto/arm.sh, which did not exist (arming lived as functions inside measure.sh). With stderr redirected the failure was invisible and the probes ran unarmed at ~1.3 GHz. Added .auto/arm.sh, .auto/disarm.sh, .auto/witness.sh and committed them; witness.sh must be run on every probe.","what_this_closes":"leg overlap (#1082, #1083) - correctly rejected, and now provably pointless: the sum of the parts is the floor. It also closes 'diar tail', 'attribution overhead', 'piece cadence', 'thread counts', 'memory sizing', 'prefault', 'dotprod/build flags'.","only_levers_left":"anything that changes the metric must make one of the two models cheaper: quantisation/weight_type (accuracy re-validation + re-bless required), KleidiAI matmul backend for CrispASR's ggml (build flag; accumulation order likely changes so byte-identity is doubtful), or accepting 0.465 as the floor for this model pair.","next_action_hint":"probe the diar weight_type session option (native/f32/f16/bf16) armed with md5 checks - it is the one remaining knob that could be numerically inert and still cut memory traffic, since both legs are model-bound."}}
{"run":1087,"commit":"ec3dd2f","metric":0.4651,"metrics":{"asr_s":49.57,"diar_s":35.78,"other_s":20.54,"first_partial_s":0.316,"p95_piece_ms":100.8,"cores_used":1.65,"peak_rss_mb":413,"witness_mhz":2304.5,"deliv2400_pct":93.1,"audio_s":227.94,"rtf_chat69":0.4631},"status":"discard","description":"Model-level path, falsified before spending accuracy budget: requantised x-asr five ways and measured on the phone armed. Weight format does not matter (q4_k at 89 MB ties q5_0 at 160 MB within 2%; q6_k +9%, iq4_nl +7%) - the ASR leg is compute-bound. Built the paired validation tool and captured the reference accuracy table, but no candidate was faster so none was validated and the blessed transcripts stay untouched.","timestamp":1790302889635,"segment":2,"confidence":null,"asi":{"hypothesis":"model-level lever: the ASR leg is memory-bound, so fewer bits per weight should cut its time (user chose the model-level path with full re-validation)","armed_screened_device":"chat69 wall / asr: q5_0 native 31.79/15.13 | all-q8_0 31.99/14.98 | q4_k 32.28/15.20 | iq4_nl 34.11/17.16 | q6_k 35.26/18.22. gate_ms_v2: native 20.84/9.74 | q8_0 21.25/9.93 | q4_k 21.30/10.03 | iq4_nl 22.47/11.16 | q6_k 23.01/11.79. Witness 2363-2365 MHz, 96.7-96.9% at 2.4 GHz.","model_fact":"x-asr-zh-en-q8_0.gguf is NOT q8_0: 298 tensors are q5_0, 619 f32, 49 f16, architecture 'xasr' (zipformer-style z.0-z.5 stages, emb.conv*, dec.*, join.*). Its metadata declares supported chunk_ms values [160,480,960,1920] - which is why my earlier 240/1600 probes errored out rather than running.","finding":"the ASR leg is weight-format INSENSITIVE across a 4.25-8.5 bit range (q4_k 89 MB vs q5_0 160 MB vs q8_0 160 MB all within 2%), and strictly WORSE for k-quants and iq4_nl (+9% q6_k, +7% iq4_nl). Compute-bound, not bandwidth-bound: requantising cannot buy time on this device, in either direction. That falsifies the premise of the model-level path before spending any accuracy budget, so the blessed transcripts stay untouched.","accuracy_budget_spared":"built .auto/validate.sh (11 clips / ~1720 s, per-clip WER + micro aggregate + word-level discordance + sign test) and captured the reference: gate_ms 0.2371, gate_ms_g100 0.2165, gate_ms_g1000 0.2062, gate_ms_v2 0.1765, control_ls 0.0422, holdout_en 0.2364, holdout_en_aligned 0.2500, holdout_zh 0.0791, holdout_zh2 0.0433, holdout_zh_aligned 0.0662, holdout_zh_ph35200 0.0641. No candidate was validated because none was faster.","what_remains_model_level":"only a cheaper model or a faster kernel backend (KleidiAI, whose kernels are not vendored here so it needs network). The diar side has no local requantiser, and the evidence says it would not help either.","next_action_hint":"floor is established and every lever class is measured. Recommend: keep byte-identity, use remaining iterations for confidence (repeat screened protocol runs) and for hardening so a resuming agent cannot re-litigate closed levers.","transcripts":"unchanged - the variants were never promoted; measure.sh still points at models/x-asr-zh-en-q8_0.gguf"}}
{"run":1088,"commit":"ea94d28","metric":0.4227,"metrics":{"asr_s":50.69,"diar_s":29.31,"other_s":16.36,"first_partial_s":0.307,"p95_piece_ms":101.3,"cores_used":1.61,"peak_rss_mb":405,"witness_mhz":2297.5,"deliv2400_pct":92.7,"audio_s":227.94,"rtf_chat69":0.425},"status":"keep","description":"Shipped diar spkcache_len 264 -> 128 (streaming geometry now expressed as the custom profile carrying very_high's other numbers). The diar leg's fixed per-window cost is dominated by speaker-cache attention, not by chunk frames: diar leg 11.94 -> 9.75 s on chat69, 5.99 -> 4.90 s on gate_ms_v2, protocol diar_s 35.78 -> 29.31. Composite 0.47 -> 0.4227, below the 0.4651 sum-of-parts floor (that floor described the shipped config's work, not a physical limit). Transcript bytes move (turn boundaries land at slightly different times), so this is a deliberate re-bless: WER bit-identical on all 11 validation clips, attribution unchanged, DER-lite 23.26 -> 23.28%, silence/noise/tone still zero turns.","timestamp":1790306813076,"segment":2,"confidence":null,"asi":{"baseline_anchor":"0.4651 (the arithmetic floor established this session: asr 0.224 + diar 0.245 s/audio-s). This row is 0.4227, i.e. BELOW that floor, which is the point: the 'floor' described the shipped configuration's work, not a physical limit. -9.1% vs the recorded baseline 0.47.","controls":"two controls make the win attributable: (a) `custom` profile fed very_high's own numbers INCLUDING spkcache_len=264 is byte-identical to the shipped build at the same speed, so the win is the speaker cache and not the profile name; (b) spkcache_len=64 is SLOWER than 128 (30.02 s vs 28.57 s chat69), so 128 is a measured minimum rather than a monotone 'less memory is faster' slope.","diar_leg":"11.94 -> 9.75 s chat69, 5.99 -> 4.90 s gate_ms_v2; protocol diar_s 35.78 -> 29.31 (-18%)","evidence_full_paired_validation":"11 clips / ~1720 s, .auto/validate.sh, ref vs candidate: WER bit-identical on ALL 11 - gate_ms 0.2371, gate_ms_g100 0.2165, gate_ms_g1000 0.2062, gate_ms_v2 0.1765, control_ls 0.0422, holdout_en 0.2364, holdout_en_aligned 0.2500, holdout_zh 0.0791, holdout_zh2 0.0433, holdout_zh_aligned 0.0662, holdout_zh_ph35200 0.0641. Attribution on gate_ms_v2 unchanged at 0.0779 of 77. DER-lite on the bilingual 57 s gate 23.26% -> 23.28%. Silence, white noise, 440 Hz tone and a 77+1000 Hz tone: zero text and zero turns, all four.","measure_s":"armed, witness 2297.5 MHz, 92.7% of time at 2.4 GHz, 2 attempts not needed (attempt=1), loadavg 21.36 (busy machine - the witness is the guard that matters)","mechanism":"the diar leg's fixed ~7-8.5 s per 188-frame encoder window is dominated by speaker-cache attention (264 frames of speaker memory), not by the chunk frames. 264 -> 128 frames halves that term; 64 does not help further, so the remaining cost moves to something else.","next":"the diar leg is now 29.31 s of the 76.4 s protocol wall, and the ASR leg (50.69 s) is the larger half. Options: (1) sweep spkcache_update_period (300 shipped) now that the cache is smaller - it is the same class of knob and the same re-bless evidence path; (2) re-derive the diar cost breakdown at 128 (what dominates the 9.75 s now?) with NEMO_PROF; (3) the ASR leg is the remaining 0.224 s/audio-s compute-bound half where only kernels or a smaller model can help.","rebless":"deliberate: bless.txt hash d0e8784b08d6168e -> 192184ebcd54977e with the evidence recorded in the file. WER ceilings left UNCHANGED (0.1800/0.2400/0.0810) - they were never widened. The byte movement is speaker-tag and segment-boundary churn: after removing labels and segment joins the text is identical on all 4 zh clips and differs on the en clips by one space at a line split.","stream_integrity":"unchanged: per-piece cached incremental decoding, 100 ms pieces, p95 piece 101.3 ms, first partial 0.307 s (flat vs 0.316 baseline), peak RSS 405 MB (down from 413).","$text":"only diar_s (-6.5 s of the -8.4 s composite). asr_s 50.69 vs 49.57 is run-to-run noise on an untouched leg."}}
