{"run":1109,"commit":"5074f0c","metric":0.2659,"metrics":{"asr_s":37.89,"diar_s":14.97,"other_s":7.76,"first_partial_s":0.25,"p95_piece_ms":77.8,"peak_rss_mb":409,"witness_mhz":2285.2,"deliv2400_pct":91.7,"audio_s":227.94,"rtf_chat69":0.2713,"cores_used":1.81},"status":"keep","description":"CORRECTION of the previous row. It recorded a ~7% opportunity - caching the diar encoder's carried speaker-state K/V across windows - because the attention mask was described as causal. Re-reading the code before building it, that is wrong: the mask is [batch, 1, frames, frames] and masks only keys at or past the VALID LENGTH, with no position-dependent mask anywhere (build_encoder_layer passes that tensor to the attention module and nothing else). Attention over [speaker cache | fifo | chunk] is therefore bidirectional, as Sortformer-with-AOS intends. That inverts the conclusion: each state frame's representation depends on the newest chunk frames, so carrying its K/V forward would quietly convert bidirectional chunk attention into causal attention and change the output. The state frames are irreducibly recomputed, and the ~2.2 s/clip estimate is void. Correction recorded in the design note, the backlog and this row. Metric unchanged at 0.2659, gate byte-identical.","timestamp":1790317605206,"segment":2,"confidence":2.273972602739726,"asi":{"how_the_error_happened":"I wrote 'the mask is causal' in the previous row's ASI after skimming a loop that indexes `key` from `lengths[batch]` to `frames` and masks those entries. What I should have asked, and did not, is what the loop does NOT mask: within [0, lengths) every query still sees every key. Reading for the presence of a mask is not the same as reading what the mask permits - and a mask's SHAPE ([batch, 1, frames, frames], one mask for all query positions) was the tell that it could not be positional, since a causal mask necessarily varies by query.","measurement":"armed, witness 2285.2 MHz / 91.7% at 2.4 GHz, battery 367. phone_rtf 0.2659, asr_s 37.89, diar_s 14.97, other_s 7.76, first_partial 0.250 s, p95 piece 77.8 ms - unchanged tree, gate byte-identical (hash 192184ebcd54977e), checks passed. Seven rows now inside 0.2659-0.2695.","rule_worth_keeping":"before building any cache on top of an attention mask, check whether the mask is indexed by POSITION or only by VALIDITY. A validity mask says 'ignore the padding'; a causal mask says 'ignore the future'. They look nearly identical in code, they mean opposite things, and only one of them makes incremental decoding legal at all. A mask that is the same tensor for every query position cannot be causal - that is a one-line check that would have caught this before it reached the ledger.","scope_of_the_correction":"the correction is recorded in three places so it cannot be inherited silently: the design note gains a section stating that the state cannot be cached and why; the backlog entry that promised ~7% is replaced with the negative result; and the earlier row's claim is named as wrong rather than quietly overwritten. An earlier iteration in this session already had to revert a diar geometry change for moving speaker decisions - the habit of correcting the record in place, rather than editing history, is the reason those reversals were caught at all.","the_opportunity_does_not_exist":"the carried 168-frame speaker state is ~33% of every window's packed length (spkcache 128 + fifo 40 + chunk), and with the encoder measured linear at 4.85-5.46 ms per frame that looked like ~2.2 s per 69 s clip, about 7% of the composite. It is not available. Because attention is bidirectional over the packed region, every state frame's representation is a function of the newest chunk frames as well as its own history; carrying its K/V forward would freeze it against the current window's audio. The state frames are irreducibly recomputed, and the only remaining way to shrink that term is a smaller spkcache_len - which changes which frames get assigned to which speaker, and has already been taken from 264 to 128 on re-blessed evidence.","what_is_left_is_now_all_external_or_out_of_contract":"with the last in-contract structural idea closed by inspection rather than by measurement, the composite's remaining time is: encoder arithmetic in int8 SDOT on both legs (KleidiAI is the only kernel lever and is verified network-blocked - both ggml copies ship the glue, no ai_micro_kernels exists on this machine), a drain that is one final window and the price of bounded turn latency, and host-side work that has measured 0% four times because it sits between computes. The honest summary is that this session moved the composite 0.4651 -> 0.2659 (-42.8%) entirely by removing work that was never model work, and what remains is work that is."}}
{"run":1110,"commit":"eb4b2d3","metric":0.2672,"metrics":{"asr_s":37.98,"diar_s":15.02,"other_s":7.91,"first_partial_s":0.255,"p95_piece_ms":77.9,"peak_rss_mb":409,"witness_mhz":2284.5,"deliv2400_pct":91.5,"audio_s":227.94,"rtf_chat69":0.2714,"cores_used":1.81},"status":"keep","description":"Cooled verification of the final kept state from a pinned, verified dependency set, plus a consolidated resume section in the design note. No code change: the point is to confirm the tree still measures and still gates after the instrumentation, measurement hooks and buffer-reuse commits that landed since the last full verification. phone_rtf 0.2672 against 0.4651-0.47 baseline (-43%), gate byte-identical, first-partial 0.255 s, p95 piece 77.9 ms. Ten rows now sit in a 1.4% band end to end, against the +/-10% spread the same protocol showed earlier in the session.","timestamp":1790318012953,"segment":2,"confidence":2.266211604095562,"asi":{"consolidated_deliverable":"docs/pipeline-design.md now ends with a resume section: the five kept changes with their individual worth (the mel filterbank -16.6% and the f16 joint -12% are the two that mattered; the other three are 1-9% each), the method that found them, every closed lever with the MECHANISM that closed it rather than the null result that suggested it, and a three-step procedure that starts with check_deps.sh - because the pinned dependency heads are where every optimisation in this session lives, and this repo tracks none of them by design.","measurement":"armed, witness 2284.5 MHz / 91.5% at 2.4 GHz, battery 359 after a 200 s cooldown. phone_rtf 0.2672, asr_s 37.98, diar_s 15.02, other_s 7.91, first_partial 0.255 s, p95 piece 77.9 ms, RSS 409 MB. Gate byte-identical (hash 192184ebcd54977e), checks passed, all three dependency heads verified before the build.","row_meaning":"no code change: the tree is the kept state, and this row exists to confirm it still measures and still gates after the instrumentation, hooks and buffer-reuse commits that landed since the previous full verification, from a pinned and verified dependency set.","stability":"ten rows now sit in 0.2659-0.2695, a 1.4% band end to end, most of them inside 0.5%. The two outliers are explained (one hot row before the cooldown protocol, one row at 78% frequency residency). For a phone benchmark that is a healthy floor: the original session's own spread was +/-10%, which is why three of its early 'wins' were noise.","what_a_resumer_should_not_retry":"in one place, with the reason next to each: weight-format changes (int8 is the 4x path and is already in use; f16 would halve the ceiling), ASR geometry (the model's own pairings are load-bearing - +5.9 and +12.9 WER when separated), elementwise and host-side micro-optimisation in the ASR leg (four separate 0% results; the discriminator is 'serialised before a compute'), diar chunk geometry (costs first-turn latency, which the contract forbids), two-pool concurrency (37-47% worse), and caching the diar encoder's speaker state (the attention is bidirectional over the packed region, so the state cannot be cached - the mask is indexed by validity, not position)."}}
{"run":1111,"commit":"1bbf861","metric":0.2671,"metrics":{"asr_s":38.08,"diar_s":14.95,"other_s":7.86,"first_partial_s":0.252,"p95_piece_ms":77.7,"peak_rss_mb":409,"witness_mhz":2297.5,"deliv2400_pct":92.4,"audio_s":227.94,"rtf_chat69":0.2713,"cores_used":1.81},"status":"keep","description":"Closed a contract gap in the validation tool and used the repaired tool to produce cumulative accuracy evidence. The session's rule is that first-output latency must not get worse, but nothing checked it: checks.sh verifies bytes and WER, and the protocol times two clips. The f16 joint is exactly the change that could flip an early argmax, so it was the one most in need of a check that did not exist; every validation clip now reports first-partial and p95-piece with bounds. Separately, --compare was scoring ZERO clips and printing an empty table - which reads as 'no difference', the most dangerous way for this tool to fail - because each run truncated the index that held other tags' manifest mappings; the index is now gone and manifests are derived. With that fixed, ref (captured before this session's mel filterbank, padding, graph-reuse and f16 changes) versus the current build is WER-identical on all 11 clips with micro 0.1019 and identical S/D/I/H. Metric unchanged at 0.2671.","timestamp":1790318710219,"segment":2,"confidence":2.258503401360544,"asi":{"cumulative_accuracy_effect_is_zero":"the repaired comparison gives the strongest accuracy statement of the session, and it is cumulative rather than per-change: ref was captured BEFORE the mel filterbank fix, the window-padding removal, the graph-reuse/UAF fix, the f16 joint, the buffer reuse and the audiocpp ggml CPU fixes. Against the current build, all 11 clips are WER-identical, the micro-average is 0.1019 with identical S/D/I/H (245/69/11/2865), text is identical on 8 of 11 and differs only by a segment-boundary space on the 3 English clips, and the sign test is vacuous. Every kept change together move no words on ~1720 s of two languages.","empty_table_is_the_dangerous_failure":"a comparison that scores zero clips and prints an empty table is indistinguishable, at a glance, from a comparison that found no differences - and that second reading is the one a reader wants. The cause was mundane and invisible: every run truncated index.tsv, deleting the other tags' manifest mappings. The fix removes the file rather than repairing it, because the clip-to-manifest mapping is derivable from the clip name and a derived fact cannot go stale; a clip that exists but cannot be scored now prints UNSCORED rather than being skipped, for the same reason. This is the fourth tool in this repo to fail quietly, and the second time the pattern was 'a table that looks like a result'.","latency_contract_previously_unverified":"the session's rules say first-output latency must not get worse, and until now nothing checked it: checks.sh verifies bytes and WER, and the protocol only times two clips. The f16 joint is precisely the change that could flip an early argmax and move first output, so it was the change most in need of a check that did not exist. Each validation clip now reports first-partial and p95-piece from the run's own [stats] line, with bounds (1.0 s / 150 ms) that can be overridden. Across all 11 clips the shipped build reports 0.13-0.27 s and ~41 ms on the host with no warnings, and the protocol's device numbers are 0.252 s and 77.7 ms - both better than the 0.32 s / 101 ms the session started from.","measurement":"armed, witness 2297.5 MHz / 92.4% at 2.4 GHz, battery 352. phone_rtf 0.2671, asr_s 38.08, diar_s 14.95, other_s 7.86, first_partial 0.252 s, p95 piece 77.7 ms, RSS 409 MB. Gate byte-identical (hash 192184ebcd54977e), checks passed. Eleven rows now in 0.2659-0.2695.","no_code_change":"this row changed no measured path: it closed a contract gap in the validation tool and then used the repaired tool to produce the cumulative accuracy evidence above. The metric is unchanged at 0.2671 by design.","what_a_candidate_now_owes":"with the tool repaired, the bar for any future numerics-changing candidate is explicit and checkable: WER and micro-WER across 11 clips, text-versus-label separation so a turn-boundary move is not mistaken for a word change, first-partial and p95 per clip, and a deliberate re-bless only if the gate's own clips actually move. A candidate that fails any of those should be understood, not argued with."}}
{"run":1112,"commit":"7ecfee9","metric":0.2664,"metrics":{"asr_s":38.02,"diar_s":14.96,"other_s":7.75,"first_partial_s":0.25,"p95_piece_ms":77.8,"peak_rss_mb":409,"witness_mhz":2294.6,"deliv2400_pct":92.2,"audio_s":227.94,"rtf_chat69":0.271,"cores_used":1.82},"status":"keep","description":"Wrote docs/kernel-brief.md - the specification for the only lever still open, built from this session's measurements rather than from the model files. It quantifies the target: both encoders already run on the fastest arithmetic the A78 has (int8 SDOT via every quantised type's vec_dot_q8_0) and achieve only 13-20% of it - ~12.7 G MAC/s effective for x-asr (12.4 M useful MACs per emitted frame, with a 61-row window emitting 12 frames, so real work is ~5x that) and ~20 G MAC/s for the diar. It names three mechanisms in order of value, and deliberately puts the bit-identical one first: ggml re-quantises activations on every mul_mat call while a block feeds the same tensor to three or four matmuls, so quantising once per tensor per step is free and needs no new kernel. It states the ceiling (25-35% of the composite at 40-60% of int8 peak) and flags that as the number most likely to be wrong. Metric unchanged at 0.2664.","timestamp":1790318974573,"segment":2,"confidence":2.5937499999999996,"asi":{"central_estimate_for_the_kernel_work":"both encoders are already on the fastest arithmetic the A78 offers - int8 SDOT, ~4x the fp32 FMA rate, reached because every quantised ggml type declares vec_dot_q8_0 - and they achieve 13-20% of it. The x-asr leg is the weaker half: 12.4 M useful MACs per emitted frame, and because a 61-row window emits only 12 frames its real work is ~5x that, giving ~12.7 G MAC/s against the diar's ~20. Both land at ~4.9 ms per encoder frame, which is a coincidence of model size rather than a shared bottleneck - but it means a kernel win applies to both legs almost equally.","measurement":"armed, witness 2294.6 MHz / 92.2% at 2.4 GHz, battery 358. phone_rtf 0.2664, asr_s 38.02, diar_s 14.96, other_s 7.75, first_partial 0.250 s, p95 piece 77.8 ms, RSS 409 MB, cores_used 1.82. Gate byte-identical (hash 192184ebcd54977e), checks passed. Twelve rows in 0.2659-0.2695.","no_measured_path_changed":"this row changed no code on the device path. Its output is a specification, and the metric is unchanged at 0.2664 by design.","the_most_actionable_item_is_not_the_gemm":"the brief's first recommendation is deliberately not the rewrite. ggml re-quantises activations to Q8_0 on EVERY mul_mat call, while a transformer block feeds the same activation tensor to three or four matmuls (q/k/v, the FFN's two projections, attention output). Quantising once per tensor per step instead of once per use is bit-identical - the quantised values are the same, only computed once - and it is a scheduling win inside the existing kernels rather than a new kernel. It is also small enough to measure in a single iteration, which is how it should be tried before committing to a GEMM rewrite that needs kernels this machine does not have.","what_the_brief_says_and_where_the_uncertainty_is":"docs/kernel-brief.md specifies the work with the numbers a kernel author needs: shapes (x-asr 19 layers, dims 192/256/512/768/512/256, ffn 512/768/1536/2048/1536/768, q5_0; diar 31 layers, hidden 512, ffn 2048, 98.2 M q5_0 weights), the three mechanisms in order of value, and what 'done' looks like. The ceiling is stated as 25-35% of the composite if the encoders reach 40-60% of int8 peak - and flagged as the number MOST LIKELY TO BE WRONG, because it extrapolates from arithmetic intensity and measured efficiency rather than from a prototype. A kernel reaching only 30% of peak would give half of it.","why_a_brief_and_not_a_patch":"KleidiAI cannot be built here (the glue is vendored in both ggml copies; no ai_micro_kernels exists anywhere on the machine), so the rewrite cannot be written, tested, or measured in this environment. What CAN be prepared is the part that does not depend on the missing kernels: the measured target, the ordered hypotheses, the bit-identical first attempt, and the measurement discipline needed to tell whether any of it worked. The brief also records a prerequisite - XASR_PROF is racy (one shared unordered_map touched by both worker threads, ~2x inflation) and cannot be used to decide whether a kernel helped, so it must be fixed before it is trusted with that question."}}
{"run":1113,"commit":"325611d","metric":0.267,"metrics":{"asr_s":38.16,"diar_s":14.88,"other_s":7.82,"first_partial_s":0.257,"p95_piece_ms":78.1,"peak_rss_mb":409,"witness_mhz":2303,"deliv2400_pct":92.9,"audio_s":227.94,"rtf_chat69":0.2728,"cores_used":1.81},"status":"keep","description":"Tested the kernel brief's own first recommendation - memoise activation quantisation, bit-identical and needing no new kernel - and measured it instead of building it. Added g_ggml_quant_elems to ggml (counted once per mul_mat call from thread 0, behind GGML_COUNT_QUANT) and had x-asr's profiler print it: the leg quantises 180.8 M activation elements per 69 s clip. But each quantised element contributes one MAC per OUTPUT ROW, so with n_out in 512-2048 it is reused about a thousand times inside the dot: the conversion is ~1/1000 of the arithmetic, ~56 ms per clip, 0.7% of the ASR leg - below the noise band. The mechanism is real, the prize is not, and the brief now drops it. The counter also reconciled an apparent 100x contradiction between two numbers I had recorded separately (12.4 M MACs per frame vs 180 M quantised elements per clip): the ratio is the average output rows per activation element. Metric unchanged at 0.2670.","timestamp":1790319437909,"segment":2,"confidence":4.124223602484475,"asi":{"cost_of_doing_it_wrong":"five quiet no-ops this session, and this row produced the worst one: a commit message that described work which was not in the tree. The first edit's python script raised on a LATER anchor before writing the file, so the counter's declaration never persisted while the message claimed it did; the build then failed with 'undeclared identifier' and the deps guard refused to let a stale binary be measured. Every failure was caught downstream rather than at the edit, which is the argument for asserting on edits rather than assuming they applied. Two off-by-one/whitespace mismatches also cost time; the pattern is that matching large code blocks by exact text is fragile, and line-indexed insertion plus a compile check is not.","hypothesis":"the kernel brief's first recommendation is actionable now and bit-identical: ggml re-quantises an activation on every mul_mat call while a block feeds the same tensor to three or four matmuls, so memoise the conversion","measurement":"armed, witness 2303.0 MHz / 92.9% at 2.4 GHz, battery 362. phone_rtf 0.2670, asr_s 38.16, diar_s 14.88, other_s 7.82, first_partial 0.257 s, p95 piece 78.1 ms, RSS 409 MB. Gate byte-identical (hash 192184ebcd54977e), checks passed. The counter is inert unless GGML_COUNT_QUANT is set, so the measured path is unchanged.","measurement_instrument_note":"the counter counts one quantisation branch of mul_mat, so the figure is a lower bound rather than a total - which is why the sizing below leans on the per-element reuse argument rather than treating 180.8 M as the whole story. Reporting it as a complete number would have repeated the mistake this row is about.","the_measurement_killed_my_own_recommendation":"with the counter in place (ggml 66fb373, crispasr c81fddd, enabled by GGML_COUNT_QUANT and printed by XASR_PROF), the x-asr leg quantises 180.8 M activation elements per 69 s clip and 118.8 M per 45 s clip. That looks substantial until you divide by what each element is worth: a quantised activation contributes one MAC per OUTPUT ROW, so with n_out in 512-2048 each element is reused roughly a thousand times inside the dot. The conversion is ~1/1000 of the arithmetic - about 56 ms per clip at 1-2 cycles/element across two threads, i.e. 0.7% of the ASR leg, which is inside the run-to-run band. So the brief's mechanism 1 is real but not worth building, and the brief now says exactly that instead of recommending it.","what_the_counter_reconciled":"it also settled a discrepancy I had been carrying without noticing: '12.4 M MACs per emitted frame' and '180 M quantised elements per clip' looked like a 100x contradiction. The ratio is simply the average number of output rows per activation element. Two numbers I had each recorded as facts were consistent all along; what was missing was the quantity that connects them, and building the instrument to measure one thing is what produced it.","what_remains":"only mechanism 2 - a specialised Q5_0 x Q8_0 GEMM shaped for k in {512, 1536, 2048} and the n these models actually use - which needs KleidiAI's kernels and therefore a network fetch, with the paired validation and deliberate re-bless that a different accumulation order implies. Everything else in the brief is now either measured and dismissed or folded into mechanism 2."}}
