{"run":1100,"commit":"51720b5","metric":0.2693,"metrics":{"asr_s":38.59,"diar_s":15.01,"other_s":7.79,"first_partial_s":0.263,"p95_piece_ms":79.1,"peak_rss_mb":409,"witness_mhz":2303.4,"deliv2400_pct":92.6,"audio_s":227.94,"rtf_chat69":0.2738,"cores_used":1.81},"status":"keep","description":"Halved the bytes of the transducer joint matrix. It is a [5000 x 512] matvec per encoder frame in plain host C++ - 3.87 s per 69 s clip, 31% of the ASR leg, invisible to the ggml profiler - streamed at ~4.5 GB/s with one use per element, so instructions were never the limit (four independent NEON accumulators: 3.87 -> 3.84 s). Storing it as f16 and widening each group to f32 before a single-accumulator FMA takes the phase to 1.11 s, and the whole ASR leg to 38.59 s. Evidence: the four gate clips stay byte-identical, and all eleven validation clips keep the reference WER exactly. This row also fixes a harness bug that had been producing fake numbers: both build scripts piped cmake to /dev/null without checking the exit status, so a compile error in a dependency was swallowed and the stale archive was measured as if it were the change.","timestamp":1790314552958,"segment":2,"confidence":4.1308016877637135,"asi":{"bigger_than_the_microbenchmark_suggested":"the joint phase itself went 3.87 -> 1.11 s, i.e. -2.76 s per 69 s clip, but the protocol's asr_s fell by 9.1 s over 4 runs (-19%) and cores_used rose 1.70 -> 1.81. More than the joint's own saving: the joint had been streaming 10.2 MB per encoder frame, and that traffic was starving every other phase sharing the two cores. This is the same lesson as the elementwise findings, in the opposite direction - on this device, work that is NOT on the critical path still moves the wall clock when it consumes shared bandwidth. p95 piece 97.1 -> 79.1 ms and first partial 0.306 -> 0.263 s came along with it.","harness_bug_this_row_fixed":"the most important thing in this row is not the number. scripts/build_android.sh and scripts/build_host.sh piped `cmake --build` to /dev/null WITHOUT checking the exit status, so a compile error in a dependency was swallowed and the previous archive got linked, pushed, measured and reported as if it were the change. That produced two confident, completely meaningless results earlier in this session (the first f16 attempt, and the NEON four-accumulator experiment that 'proved' vectorising does not help). Both scripts now fail loudly and print the compiler's errors before anything can be measured. If you change a dependency and the timing does not move AT ALL, suspect this class of bug before believing the physics.","hypothesis":"the transducer joint is bandwidth-bound on its 10.2 MB matrix, so halving the bytes should cut the phase","measurement":"armed, witness 2303.4 MHz / 92.6% at 2.4 GHz, battery 352. phone_rtf 0.2693 (from 0.3073), asr_s 38.59 (from 47.73), diar_s 15.01, other_s 7.79, first_partial 0.263 s, p95 piece 79.1 ms, cores_used 1.81, peak RSS 409 MB (+5 MB for the f16 mirror of the joint matrix).","mechanism":"the joint is a [5000 x 512] matvec per encoder frame in plain host C++ - 4.4 GMAC and 10.2 MB of weight reads per 69 s clip, 3.87 s measured, 31% of the ASR leg, and completely invisible to the ggml eval-callback profile because it is not a ggml op. Vectorising the arithmetic did nothing (3.84 s, four independent NEON accumulators), which is the evidence that the limit was bytes rather than instructions. Storing the matrix as f16 and widening each group to f32 before a single-accumulator FMA keeps the arithmetic shape (ascending j, one accumulator from the bias) and changes only the weight precision.","nothing_traded":"first-output latency IMPROVED (0.306 -> 0.263 s), p95 piece latency improved 97 -> 79 ms, RSS +5 MB. The only cost is 5 MB for the f16 mirror.","next":"with the ASR leg's joint now at 1.11 s, re-run the ASR phase split to see what the new bottleneck is - the encoder compute (~19 s profiled per 69 s clip) now has the bandwidth it needed, and the host phases (inputs 0.2 + outputs 0.56 s per clip) may now be worth relatively more. The same question on the diar side: its encoder is ~6.6 s per 69 s clip and has never been phase-split after the filterbank fix. Both are one measurement each.","numerics_evidence":"the weight rounding is a real numerical change, so it was held to full evidence rather than to the gate alone: the four gate clips are BYTE-IDENTICAL (host hash 192184ebcd54977e, WER 0.1765/0.2364/0.0791, attribution 0.0779 of 77, DER-lite 23.28%), and all ELEVEN validation clips keep the reference WER exactly (0.2371/0.2165/0.2062/0.1765/0.0422/0.2364/0.2500/0.0791/0.0433/0.0662/0.0641). Seven of the eleven raw transcripts move, but only in where a segment splits and which speaker tag it carries: after stripping labels and segment joins the text is character-identical on the four Chinese clips, and the English clips differ by one space at a segment boundary. No recognised word changes anywhere, and the gate clips - which are the contract - are unchanged, so no re-bless is required."}}
{"run":1101,"commit":"86b2282","metric":0.2692,"metrics":{"asr_s":38.67,"diar_s":14.94,"other_s":7.76,"first_partial_s":0.255,"p95_piece_ms":78.8,"peak_rss_mb":409,"witness_mhz":2305.4,"deliv2400_pct":92.8,"audio_s":227.94,"rtf_chat69":0.2739,"cores_used":1.81},"status":"keep","description":"Cooled verification of the final state: after 200 s of cooling (battery 360 -> 352), the kept tree measures 0.2692 against 0.2693 on the previous row - a 0.04% spread across four consecutive rows, where the same protocol varied by +/-10% earlier in the session. The composite now stands at 0.269 against a 0.4651-0.47 baseline (-42%), byte-identical on the four gate clips, with first-partial latency improved 0.32 -> 0.255 s and p95 piece latency 101 -> 79 ms. Nothing was changed to produce this row; it establishes that the number is reproducible now that the harness no longer links stale archives and the thermal confound is understood.","timestamp":1790314946756,"segment":2,"confidence":4.132911392405064,"asi":{"measurement":"armed, witness 2305.4 MHz / 92.8% at 2.4 GHz, battery 352 after a 200 s cooldown. asr_s 38.67, diar_s 14.94, other_s 7.76, first_partial 0.255 s, p95 piece 78.8 ms, cores_used 1.81, RSS 409 MB, device transcript hash 775d7b3ec4a0 (the informational HASH line moved with the f16 joint because segment boundaries move; the four gate clips that the contract covers remain byte-identical, and checks.sh passed).","note_on_how_this_row_was_produced":"this is the same class of run as the previous three, not a special measurement. Nothing was changed between them except the cooldown, which is the point: the run-to-run spread is now inside 0.05% across four consecutive rows, versus +/-10% before the harness was fixed and the thermal confound was understood. That stability is itself the useful result here - the remaining work should be judged against a +/-0.5% noise floor, not the +/-10% the loop started with.","open_after_this_row":"(1) Re-split both encoders now that the joint is no longer competing for memory bandwidth: the ASR encoder compute measured ~19 s per 69 s clip with the joint in the way, and the diar encoder at ~6.6 s has not been phase-split since the filterbank fix. (2) q8_0 joint weights: the phase is 1.11 s, so a further 2x is worth ~1 s/clip (~2% composite) and needs the validation path again - low priority. (3) KleidiAI: the only untried kernel-level lever, blocked on a network fetch. (4) One-runtime merge: ceiling is the core utilisation, now 1.81/2 rather than 1.61/2, so the prize shrank accordingly - the container merge it depends on is already in place and neutral.","row_meaning":"unchanged tree; this row establishes that 0.269 is reproducible and not a lucky thermal pocket, which is the last thing worth checking before moving on.","what_is_left_is_genuine":"both encoders are on int8 SDOT already (x-asr: 298 q5_0 tensors; diar: 130 q5_0 tensors = 99.5 MB), so there is no precision lever left on either - unlike the joint, which was f32 in host C++ and had 10.2 MB to stream per frame. What remains in the 61 s of protocol wall is encoder arithmetic plus one final diar window for the drain, and the only lever that touches encoder arithmetic on this contract is KleidiAI (network) or a different model (out of contract). The session moved the composite from 0.4651 to 0.2692 by removing work that was never model work at all: a filterbank multiplying 98.5% zeros in software quad precision, a 4,000-node graph rebuilt every step, and a 10.2 MB matvec streamed once per encoder frame."}}
{"run":1102,"commit":"428d924","metric":0.2695,"metrics":{"asr_s":38.71,"diar_s":15.01,"other_s":7.71,"first_partial_s":0.257,"p95_piece_ms":78.6,"peak_rss_mb":409,"witness_mhz":2314.6,"deliv2400_pct":93.5,"audio_s":227.94,"rtf_chat69":0.2742,"cores_used":1.81},"status":"discard","description":"Ported the two bit-identical ggml CPU fixes (per-element 64-bit division in the non-contiguous binary-op index; unconditional two-thread split of small copy/elementwise ops) into audiocpp's vendored ggml, on the hypothesis that the diar encoder would feel them where the matmul-bound ASR leg did not - its graph is elementwise-heavy (285 ADD nodes over 76M elements and 312 MUL over 41M per window, against 128 MUL_MAT). Byte-identical on the gate as expected, and measurably flat: 0.2695 vs 0.2692, diar_s 15.01 vs 14.94. That closes the class properly - the same fixes measured 0% on the ASR leg and now 0% on the diar leg - so the remaining composite time is matmul arithmetic and weight streaming in kernels we do not own, not elementwise dispatch.","timestamp":1790315264147,"segment":2,"confidence":4.132911392405064,"asi":{"closes_a_class":"this is the same pair of fixes, in the other ggml, landing on a different cost structure - and measuring 0.0% again. Combined with the crispasr results (#1091, #1092), the conclusion is now properly bounded rather than assumed: on this composite, neither copy of ggml spends meaningful time in the non-contiguous elementwise path or in per-op thread dispatch, on either leg. The elementwise tax is real in the source and free in practice, because it is hidden under matmuls and memory streaming.","fixed_while_proving_it_irrelevant":"the changes stay: they remove a 64-bit division per element and a barrier per small op, in a path that other configurations (bigger tensors, more threads, a machine with more cores) would feel. They are bit-identical and strictly less work. Keeping a fix that measures 0% is fine when the fix is unambiguously a reduction in work; keeping it because it might help later is not a reason, and this row is the evidence that it does not help now.","hypothesis":"audiocpp's vendored ggml is a different copy from the one already fixed, and the diar encoder is elementwise-heavy (285 ADD nodes/76M elements and 312 MUL/41M per window vs only 128 MUL_MAT), so the same two bit-identical fixes should land there even though they measured 0% on the matmul-bound ASR leg","measurement":"armed, witness 2314.6 MHz / 93.5% at 2.4 GHz, battery 355. phone_rtf 0.2695 vs 0.2692, diar_s 15.01 vs 14.94, other_s 7.71 vs 7.76, asr_s 38.71 vs 38.67 - all inside the 0.05% run-to-run spread, i.e. no effect. Byte-identical on the gate (hash 192184ebcd54977e) and checks passed.","what_the_composite_is_now_made_of":"ASR ~63% (encoder matmuls on int8 SDOT, plus a 1.11 s f16 joint), diar ~24% (its transformer encoder), drain ~13% (one final window, and the price of bounded turn latency). Both encoders' weight formats are insensitive because every quantised ggml type declares vec_dot_type = Q8_0, so activations are quantised and dotted with SDOT whatever the weights are. What is left is arithmetic and weight streaming in kernels we do not own: KleidiAI (needs a network fetch) or a different model (outside the contract).","also_checked_and_closed":"x-asr's left context: the implementation reads xasr.left_context_frames = [96, 256, 256, 256] as a table INDEXED BY chunk_ms (160 -> 96, 480 -> 256), not per encoder stage, and then divides the chosen value by each stage's downsampling factor. So the shipped 256 is the model's own geometry for the shipped 480 ms chunk, not an implementation over-provision - a hypothesis raised and dropped in one read rather than by experiment."}}
{"run":1103,"commit":"00f2852","metric":0.2691,"metrics":{"asr_s":38.64,"diar_s":14.94,"other_s":7.76,"first_partial_s":0.259,"p95_piece_ms":78.7,"peak_rss_mb":409,"witness_mhz":2043.6,"deliv2400_pct":78,"audio_s":227.94,"rtf_chat69":0.2738,"cores_used":1.81},"status":"keep","description":"Pinned the dependency worktrees and made the build refuse to run against anything else. Every optimisation of this session lives in ref/crispasr and ref/audiocpp - two separate repositories outside this project, which tracked only a patch file - so a clean checkout would have rebuilt the 0.47 baseline while the ledger claimed 0.269, with nothing to say so. deps.lock now records the three heads with a note on what each contains, and scripts/check_deps.sh (called by both build scripts) fails on drift or a dirty worktree unless ALLOW_DEPS_DRIFT=1. This is the swallowed-cmake-exit-code lesson one level up: a dependency that is not what you think it is is indistinguishable from an optimisation that did not work. Metric unchanged at 0.2691, as expected for a row that changes no measured code.","timestamp":1790315558060,"segment":2,"confidence":4.135021097046414,"asi":{"measurement":"armed, witness 2043.6 MHz but only 78.0% of time at the 2.4 GHz step - a weaker arm than the last three rows (92.6-93.5%) - and the result is still 0.2691, matching 0.2692/0.2693/0.2695. A useful accidental robustness check: the composite now reproduces within 0.15% across a 10-point swing in the 2.4 GHz residency share, whereas earlier in the session the same protocol moved 10% on a comparable swing. The per-leg split is unchanged too (asr 38.64, diar 14.94, other 7.76).","no_metric_change_this_row":"phone_rtf 0.2691 vs 0.2692: nothing in the measured path moved, and that is the point of the row. The work was making the measurement trustworthy, not making the code faster.","the_general_lesson_is_the_whole_session_s":"Three separate times this session, a measurement said something false and the code was innocent: cmake exit codes swallowed so a stale archive was measured as a fresh one (twice), and a dependency worktree that nothing tracked so a clean checkout would have rebuilt the 0.47 baseline while the ledger claimed 0.269. Each was found by disbelieving a number, and each is now structurally prevented rather than documented: the build fails loudly on a compile error, and it refuses to build against unpinned dependencies. The optimisations themselves were found by disbelieving a label - three separate 'model-bound' legs were carrying signal processing, bookkeeping and host matvecs that no model profiler could see.","verification_done":"(1) deps.lock matches all three worktrees and a full host rebuild reproduces the blessed transcript hash 192184ebcd54977e. (2) Negative test: moving audiocpp's git HEAD makes check_deps.sh exit 1 and build_host.sh exit 1 with the message 'the result will not correspond to the recorded numbers'; restoring it returns both to 0. A guard that has never been seen to fail is a guard that does not work, so it was tested against a deliberately broken state rather than assumed. (3) crispasr's gitlink for its ggml submodule now names the measured commit, so crispasr is clean and a checkout there can no longer revert the CPU fixes.","whats_left":"unchanged and honestly bounded: both encoders are on int8 SDOT and weight-format-insensitive by construction (every quantised ggml type declares vec_dot_type = Q8_0), the elementwise path is measured irrelevant on both legs, the joint is f16 and down to 1.11 s, the drain is one final window and the price of bounded turn latency, and the merged single-GGUF deployment is in place and neutral. The only remaining levers are KleidiAI (blocked on a network fetch for the arm_llama kernels), a one-runtime merge whose ceiling has shrunk as core utilisation rose from 1.61/2 to 1.81/2, and a cheaper model pair (outside the contract)."}}
{"run":1104,"commit":"f8a47c9","metric":0.2684,"metrics":{"asr_s":38.5,"diar_s":14.91,"other_s":7.76,"first_partial_s":0.261,"p95_piece_ms":78.6,"peak_rss_mb":409,"witness_mhz":2306.4,"deliv2400_pct":93,"audio_s":227.94,"rtf_chat69":0.2729,"cores_used":1.81},"status":"discard","description":"Tested the one remaining geometry lever in the ASR encoder: the model's left_context_frames table is indexed by chunk_ms ([160,480,960,1920] -> [96,256,256,256]), so the shipped 480 ms chunk carries 256 frames of left context where the model's own 160 ms chunk carries 96, and per-stage attention is O(seq x (left/ds + seq)). Added a measurement hook (XASR_LEFT_CTX, inert by default) and probed 192/128/96 on the host: the speed available is 2-5% of the ASR leg and the cost is severe and non-monotonic - gate_ms_v2 WER 0.1765 -> 0.2000 / 0.3059 / 0.2471. Rejected on accuracy, no re-bless, default unchanged and gate byte-identical. The useful by-product is that attention is only ~5% of the encoder, so its cost is dominated by left-context-independent FFN/conv matmuls.","timestamp":1790315889326,"segment":2,"confidence":4.135021097046414,"asi":{"cost_of_closing_it_was_one_commit":"the whole question cost one committed hook and two host runs, because the hypothesis was cheap to test in the shape the model actually ships it: a table indexed by chunk_ms, readable in one grep. That is the third time this session that reading the model's own metadata answered a question that would otherwise have become an experiment - the other two being the supported chunk_ms set [160, 480, 960, 1920] and the weight dtypes (298 q5_0, 619 f32, 49 f16 in a file named q8_0).","encoder_cost_structure_now_measured":"this is the useful by-product: per-stage attention is only ~5% of the encoder (a 2.7x cut in left context bought 5% of the ASR leg on the host, and less than that after the 2-5% that the non-attention part of the graph accounts for). So the ASR encoder's cost is dominated by work that is INDEPENDENT of left context - the FFN and conv blocks and their matmuls - which is consistent with everything else: weight-format insensitivity, SDOT-bound matmuls, elementwise fixes worth 0%. There is no geometry that makes this encoder cheaper; only fewer FLOPs or faster kernels.","hypothesis":"the model's left_context_frames table is indexed by chunk_ms, pairing 480 ms with 256 frames of context where 160 ms gets 96; since per-stage attention is O(seq x (left/ds + seq)), the shipped pairing may be leaving a large compute reduction on the table","measurement":"armed, witness 2306.4 MHz / 93.0% at 2.4 GHz, battery 355. phone_rtf 0.2684 (vs 0.2691), asr_s 38.50 (vs 38.64), all inside the 0.05% spread: the shipped default is unchanged, as intended, since the hook is inert unless XASR_LEFT_CTX is set. Gate byte-identical (hash 192184ebcd54977e), checks passed.","not_overfitting_because_it_failed":"worth being explicit: a 3% speed gain for +13 WER points on the primary gate clip is not a trade worth making on any reading, and the 96 case (+7 points for 5%) is the same story softer. Nothing here was tuned against the benchmark - the values probed are the model's own declared left contexts, and the direction of the result (smaller context is much worse) is a property of the model, not of these clips.","next":"The encoder's remaining cost is left-context-independent arithmetic in kernels we do not own: KleidiAI (network-blocked), a one-runtime merge whose ceiling keeps shrinking as utilisation rises, or a different model (outside contract). The one host-side item left is the ASR cache round-trip (outputs 0.56 + inputs 0.20 s per 69 s clip, 114 cache tensors per step going graph -> host vector -> graph); it is bit-identical in principle, but every host-side phase measured so far has been hidden under the matmuls, so it should be expected to be worth ~1% and not more.","rejected_on_accuracy_host_evidence":"gate_ms_v2 WER by left context: 256 (shipped) 0.1765 in 4.11 s | 192 -> 0.2000 (+2.4 pts, -2% time) | 128 -> 0.3059 (+12.9 pts, -3% time) | 96 -> 0.2471 (+7.1 pts, -5% time). The speed available is 2-5% of the ASR leg; the accuracy cost is an order of magnitude larger than anything the re-bless policy would accept, and the non-monotonicity (96 better than 128) says the decoder is sensitive to where the context boundary lands, not merely to its size. The model's pairing of 256 with a 480 ms chunk is load-bearing.","tooling_note_the_guard_fired_on_me":"the new deps guard immediately caught this iteration's first attempt: I edited crispasr and ran a build without committing, so check_deps.sh refused and the probe silently ran the PREVIOUS binary - two identical rows (4.02/4.03 s, identical WER) that would have read as 'the override does nothing'. Committing the dependency first, then measuring, is now the enforced workflow. That is the second time this session a stale binary nearly produced a confident wrong conclusion."}}
