{"run":1114,"commit":"15f7340","metric":0.2662,"metrics":{"asr_s":37.83,"diar_s":14.94,"other_s":7.91,"first_partial_s":0.255,"p95_piece_ms":77.7,"peak_rss_mb":409,"witness_mhz":2286.3,"deliv2400_pct":91.7,"audio_s":227.94,"rtf_chat69":0.2708,"cores_used":1.81},"status":"keep","description":"Closed the kernel brief's own prerequisite and then used it to answer the question the brief had said was inferable. XASR_PROF was a data race - one shared accumulator mutated by both worker threads - so it could not be trusted to judge whether a kernel helped; each thread now owns a thread_local accumulator and dump() merges them under a lock taken only at print time. Added a MUL_MAT histogram by (k x n). The result: essentially ALL of the x-asr encoder's matmul time is in calls with n = 3-24 columns (512x6, 768x3, 1536x3, 256x12 are the top shapes), because the encoder downsamples time by [1,2,4,8,4,2] and a 24-frame chunk reaches the deep, wide stages as 3 columns. At n=3 a GEMM cannot exceed single-digit percent of peak regardless of kernel quality, so the 13-20% figure I had been quoting was a SHAPE result, not a kernel-quality result. Batching - the standard remedy - is unavailable because the column count is the model's streaming chunk. Metric unchanged at 0.2662.","timestamp":1790319789559,"segment":2,"confidence":4.387665198237886,"asi":{"measurement":"armed, witness 2286.3 MHz / 91.7% at 2.4 GHz, battery 369. phone_rtf 0.2662, asr_s 37.83, diar_s 14.94, other_s 7.91, first_partial 0.255 s, p95 piece 77.7 ms, RSS 409 MB. Gate byte-identical (hash 192184ebcd54977e), checks passed. The profiler changes are inert unless XASR_PROF is set, so the measured path is unchanged.","prerequisite_closed":"the kernel brief listed 'fix the profiler' as a precondition for trusting any kernel measurement, and it was genuinely broken: the eval callback runs on both worker threads and every field of one shared accumulator was mutated without a lock. It had found real problems (the per-element division) but could not have been trusted to decide whether a new kernel helped. Each thread now owns a thread_local accumulator and dump() merges under a short lock at print time - a mutex per node would serialise the thing being measured.","row_meaning":"no change to the measured path. The output is a measurement that converts the last open lever from a guess into a specification: the kernel requirement is now 'fast at n = 3-24', not 'fast'.","the_measurement":"with the profiler race fixed and a MUL_MAT histogram added, the x-asr encoder's matmul time is almost entirely in calls with n between 3 and 24 columns: 512x6 (9344 calls, 166 us each, 7.9% of accounted), 768x3 (5840, 230 us, 6.9%), 1536x3 (2190, 303 us, 3.4%), 256x12 (4672, 101 us, 2.4%), 1152x6 (2336, 187 us, 2.2%); the top 12 of 54 distinct shapes cover about a third of accounted time. The cause is structural - the encoder downsamples time by [1,2,4,8,4,2] across six stages, so a 24-frame chunk reaches the deep, wide stages (dims 512-768, ffn 1536-2048, where most parameters live) as 3 columns.","why_this_closes_the_diagnosis":"at n=3 a GEMM reaches single-digit percent of int8 peak no matter how good the kernel is: there is no reuse of the weight matrix across columns to amortise the stream, and per-call setup plus the thread barrier dominate. So the '13-20% of peak' I had been quoting was never a kernel-quality figure - it was a shape figure, and the two call for completely different responses. Batching skinny GEMMs is the standard remedy and it is UNAVAILABLE here, because the column count is the time axis after downsampling and the model's streaming chunk fixes it; enlarging the chunk is the change already measured at +5.9 WER on the primary gate clip, and halving the step count while keeping the same rows would recompute rows the model already emitted. The shape therefore cannot be engineered away in-graph.","what_the_brief_says_now":"the requirement is sharper and narrower than 'make the GEMM faster': a kernel that is fast at n = 3-24 with k in 192-2560, int8 accumulate into int32, two threads on two A78s. A kernel tuned for large N would not help this workload at all - which is also the most useful thing to tell someone about to spend time on KleidiAI, since the temptation will be to benchmark it on large square matmuls where it looks excellent."}}
{"run":1115,"commit":"2d86358","metric":0.2674,"metrics":{"asr_s":38.06,"diar_s":15.04,"other_s":7.86,"first_partial_s":0.258,"p95_piece_ms":77.9,"peak_rss_mb":409,"witness_mhz":2301.5,"deliv2400_pct":92.6,"audio_s":227.94,"rtf_chat69":0.2718,"cores_used":1.81},"status":"keep","description":"Completed the shape analysis on the other leg, and it inverts the priority. The diar encoder's MUL_MAT shapes are k = 512/1536/2048 with n = 351, 380, 548 - conventional GEMM shapes with hundreds of columns - the opposite of the ASR's n = 3-24. That also explains the measured efficiency gap between the legs (diar ~20 G MAC/s vs x-asr ~12.7) with no appeal to kernel quality: same library, same instructions, same weight format, different shapes. So the best remaining target is the diar: about a quarter of the composite, already feeding kernels the shape they handle well, and the leg this project has spent the least time on. The ASR's small-N problem remains a separate, harder project whose usual remedy (batching) is unavailable because the column count is the model's streaming chunk. Metric unchanged at 0.2674.","timestamp":1790320044548,"segment":2,"confidence":4.687058823529413,"asi":{"measurement":"armed, witness 2301.5 MHz / 92.6% at 2.4 GHz, battery 370. phone_rtf 0.2674, asr_s 38.06, diar_s 15.04, other_s 7.86, first_partial 0.258 s, p95 piece 77.9 ms, RSS 409 MB. Gate byte-identical (hash 192184ebcd54977e), checks passed. The new histogram is inert unless AUDIOCPP_PROF is set, so the measured path is unchanged.","no_change_to_the_measured_path":"the output is a measurement that re-prioritises the only remaining lever. The metric is unchanged at 0.2674 by design.","structural_not_timed_and_why":"the diar numbers are node and element counts per shape, not times, because this graph is planned and run on a bare ggml backend with no eval callback to borrow the way x-asr has one. That is enough for the question being asked - whether the shapes are fat or skinny - because a GEMM's arithmetic intensity is a property of its shape, not of how long it took. Converting counts to time would need the timing hook, and the shape answer did not depend on it.","row_meaning":"two iterations ago the brief said the remaining lever was 'a faster GEMM'. Last iteration measured why the ASR is slow and found it was a shape problem, not a kernel problem. This iteration measures the other leg and finds the opposite - which changes which leg to work on, and by how much.","the_measurement":"the diar encoder's MUL_MAT shapes on chat69 are k = 512 / 1536 / 2048 with n = 351, 380 and 548 - 20 to 30 nodes per shape per window and 3.7-11.6 M elements each. Hundreds of columns, exactly the regime a tuned int8 GEMM is built for. This also explains the measured efficiency gap between the legs (diar ~20 G MAC/s versus x-asr ~12.7) with no appeal to kernel quality: same library, same instructions, same weights format, different shapes.","why_it_matters_more_than_the_number":"it inverts the priority. The diar is about a quarter of the composite (15.0 s of 61 s), it is already handing the GEMM the shape it handles well, and it is the leg this project has spent the least time on - every structural change so far (spkcache, padding, filterbank) landed on it by accident of where the profiling pointed, while the ASR absorbed all the kernel theorising. A 2-3x on the diar encoder is plausible with a drop-in GEMM replacement and has no structural obstacle. The ASR's small-N problem is a separate, harder project whose usual remedy is unavailable.","what_a_resumer_should_do":"diar first, ASR second - and do NOT validate a candidate GEMM on large square matmuls, which is what everyone does and which would show the diar case beautifully and the ASR case not at all. For the diar the requirement is unremarkable (k in {512, 1536, 2048}, n in {351, 548}, int8 accumulate to int32, f32 out, two threads on two A78s). The availability question is the same for both: KleidiAI's kernels are not on this machine, so the work is a specification until someone fetches them."}}
{"run":1116,"commit":"d05dcf6","metric":0.2664,"metrics":{"asr_s":37.85,"diar_s":14.95,"other_s":7.93,"first_partial_s":0.241,"p95_piece_ms":77.7,"peak_rss_mb":409,"witness_mhz":2291.1,"deliv2400_pct":92,"audio_s":227.94,"rtf_chat69":0.2708,"cores_used":1.81},"status":"keep","description":"Proposed converting the diar's weights from q5_0 to q8_0 so its matmuls would reach ggml's .nrows = 2 dotprod path, with a sharp prediction from the shape analysis (helps the diar at 351-548 columns, does nothing for the ASR at n = 3-24, which also explains the early format sweep tying). Built the converter, and it failed - and the failure exposed that BOTH models already ship Q8_0. These ggml copies number types Q5_0=6, Q8_0=8; the histograms were read with the older llama.cpp numbering where 8 means q5_0. Confirmed twice independently: payload density is 8.5 bits/element (q8_0, not q5_0's 5.5), and gguf_get_tensor_size disagreed with my q5_0 arithmetic. So the hypothesis was dead on arrival, and the correction matters more than the speed run.","timestamp":1790320449756,"segment":2,"confidence":4.765550239234449,"asi":{"how_it_was_caught_and_what_it_cost":"the clue arrived as a parser failure: my q5_0 -> q8_0 converter could not reshape a 278,528-byte payload into 22-byte blocks, and gguf_get_tensor_size returned the same 278,528 where q5_0 arithmetic expected 180,224. I spent several steps treating that as an offset bug in MY code before dividing 278,528 by 512x512 and getting 1.0625 bytes/element - 8.5 bits, which is q8_0's density and not q5_0's 5.5. Two independent facts were sitting in front of me and the one I trusted was my own arithmetic. The lesson is narrow and checkable: when a library and your arithmetic disagree about a file format, ask the library - which is now gsize.c in the session, and takes seconds.","hypothesis":"ggml gives Q8_0 .nrows = 2 under dotprod (two weight rows per activation load) but hard-codes Q5_0 to .nrows = 1, and the diar ships q5_0 - so converting the diar to q8_0 should roughly halve its activation traffic. The shape analysis says the diar runs 351-548 columns, where activation traffic dominates, unlike the ASR's n = 3-24 where it does not - which also explains why the early ASR format sweep tied.","measurement":"armed, witness 2291.1 MHz / 92.0% at 2.4 GHz, battery 364. phone_rtf 0.2664, asr_s 37.85, diar_s 14.95, other_s 7.93, first_partial 0.241 s, p95 piece 77.7 ms, RSS 409 MB. Gate byte-identical (hash 192184ebcd54977e), checks passed. No code on the measured path changed: the correction is to the record, and the conversion tool built for the dead idea was deleted rather than shipped.","the_correction":"both models ship Q8_0, not q5_0. These two vendored ggml copies number the quantised types Q4_0=2, Q4_1=3, Q5_0=6, Q5_1=7, Q8_0=8; the histograms behind the q5_0 story were read with the older llama.cpp numbering where type 8 means q5_0. So x-asr is 619 F32 / 49 F16 / 298 Q8_0, and the diar is 130 Q8_0 - which is what its filename always said - plus 229 tensors of an audio.cpp-specific type id (2.0 MB total, meaning unestablished, not worth chasing).","what_dies_and_what_survives":"Dead: 'the diar's weights are q5_0', 'the diar is missing the two-row path', and any conversion motivated by either - tools/requant_gguf.py is deleted rather than left looking plausible. Alive and reinforced: weight format cannot help this composite, because every quantised type dots through vec_dot_q8_0 and int8 SDOT is the core's fastest arithmetic, and the shipped weights are already the type that gets .nrows = 2. The conclusion was right and the reasoning was wrong, which is worth recording on its own: a right answer for the wrong reason does not survive the next person who reads the evidence. Also noted: the requantisation sweep's 'all q8_0' arm was probably vacuous for the same reason, though q4_k / q4_0 / iq4_nl / q6_k were genuine conversions, so the sweep's conclusion stands. Unaffected: every shape and timing measurement in the brief, which came from the profilers rather than from dtype histograms."}}
{"run":1117,"commit":"d1fff90","metric":0.2666,"metrics":{"asr_s":38,"diar_s":14.95,"other_s":7.82,"first_partial_s":0.254,"p95_piece_ms":77.8,"peak_rss_mb":409,"witness_mhz":2295.3,"deliv2400_pct":92.3,"audio_s":227.94,"rtf_chat69":0.2719,"cores_used":1.81},"status":"keep","description":"Audited the measurement foundation after last row's enum error, and fixed the CLASS rather than the instance. tools/gguf_inventory.py reports every tensor by type AND by bits per element, where density comes from payload size and element count with no enum involved - so a tensor labelled q5_0 that occupies 8.5 bits per element is visibly not a q5_0, whatever the type id says. The audit confirms both models: x-asr 298 Q8_0 / 619 F32 / 49 F16 at 8.50 / 32.00 / 16.00 bits, diar 130 Q8_0 at 8.50, plus 229 tensors of an audio.cpp-specific id that density resolves to 16 bits/element (F16/BF16 class - the norms and biases, 2.0 MB). Every named type's density matches its label, and the last unknown from the correction is settled. Metric unchanged at 0.2666.","timestamp":1790320668236,"segment":2,"confidence":4.84671532846715,"asi":{"inventory":"tools/gguf_inventory.py on both models: x-asr 298 Q8_0 / 619 F32 / 49 F16 at 8.50, 32.00 and 16.00 bits per element; diar 130 Q8_0 at 8.50, 229 tensors of an audio.cpp-specific id at 16.00 bits (F16/BF16 class - the norms and biases, 1.0 M elements, 2.0 MB), plus 1 F32 and 2 F16. Every named type's density matches its label exactly, and the last unknown from the previous row is resolved and turns out to be the least interesting thing in the file.","measurement":"armed, witness 2295.3 MHz / 92.3% at 2.4 GHz, battery 368. phone_rtf 0.2666, asr_s 38.00, diar_s 14.95, other_s 7.82, first_partial 0.254 s, p95 piece 77.8 ms, RSS 409 MB. Gate byte-identical (hash 192184ebcd54977e), checks passed. No code on the measured path changed.","row_meaning":"this row changes no measured code. It closes the loop on the previous row's error by making the CLASS of error detectable rather than just correcting the instance - which matters because that error supported several conclusions in the ledger, and because the next person to read a GGUF here will hit the same enum trap.","the_general_fix_is_a_self_checking_number":"the enum mistake was not fixed by memorising a different enum - enums are exactly the thing you get wrong from memory. The fix is to report a quantity that cannot be mislabelled: bits per element, derived from payload size and element count with no enum involved. A tensor called q5_0 occupying 8.5 bits per element is visibly not a q5_0. Cross-checked against gguf_get_tensor_size, the table validates itself, and both halves cost seconds.","what_this_buys_the_next_iteration":"every remaining claim in the brief now rests on numbers that carry their own verification: shapes and times from the profilers, density-checked dtypes from the inventory, and the gate's byte-identity on the transcripts themselves. If a future candidate changes a weight format - the one lever that is closed by arithmetic - the first question is answered by running one command rather than by re-deriving an enum from memory."}}
{"run":1118,"commit":"5b2a4c6","metric":0.2667,"metrics":{"asr_s":37.96,"diar_s":14.93,"other_s":7.9,"first_partial_s":0.249,"p95_piece_ms":78,"peak_rss_mb":409,"witness_mhz":2292.7,"deliv2400_pct":92.1,"audio_s":227.94,"rtf_chat69":0.2719,"cores_used":1.82},"status":"keep","description":"Stopped splitting skinny matmuls across threads: the x-asr encoder runs its GEMMs at 3-24 columns and issues ~65k per 69 s clip, so each call was paying a two-thread dispatch and a barrier to hand one or two columns to the second core. Below 16 columns the rows now stay on one thread - bit-identical, since row partitioning decides which core runs a row and not what is computed. Measured flat: 0.2667 vs 0.2666, asr_s 37.96 vs 38.00, gate byte-identical. Kept because it is strictly less synchronisation and demonstrably not harmful, not because it is faster.","timestamp":1790321054891,"segment":2,"confidence":8.912751677852356,"asi":{"change":"ref/crispasr/ggml 512a020: ggml_get_n_tasks now sends MUL_MAT to one thread below 16 columns. Row partitioning is untouched, so this is bit-identical, and the host gate confirms it (hash 192184ebcd54977e, WER and attribution unchanged).","confounded_reading_i_had_to_discard":"I compared cores_used 0.98 before and 1.74 after and it looked like a clean win - then noticed the 'before' was an ASR-only probe from EARLY in the session, before graph reuse, the f16 joint and buffer reuse. The wall time in that same probe was 25.0 s for chat69 and is 11.5 s now, which is the sum of all those changes, not this one. So the utilisation difference is not attributable to this commit, and I am not claiming it. The barrier tax remains a plausible mechanism with no measured effect.","hypothesis":"the x-asr encoder runs its GEMMs at 3-24 columns and issues ~65k of them per 69 s clip, so every call paid a two-thread dispatch and a barrier to hand one or two columns to the second core; keeping skinny matmuls on one thread should remove that tax","kept_because_it_is_strictly_less_work_not_because_it_is_faster":"bit-identical (row partitioning decides which core runs a row, not what is computed), strictly fewer synchronisations, and measured neutral rather than harmful - the same standard applied to the earlier copy/elementwise threshold. Had it shown a regression I would have reverted it.","measurement":"armed, witness 2292.7 MHz / 92.1% at 2.4 GHz, battery 367. phone_rtf 0.2667 (vs 0.2666), asr_s 37.96 (vs 38.00), diar_s 14.93, other_s 7.90, first_partial 0.249 s, p95 piece 78.0 ms, cores_used 1.82, RSS 409 MB. Gate byte-identical, checks passed. ASR-only chat69: 11.50 s wall, 20.0 s cpu (1.74 cores), rtf 0.1669.","next":"the remaining open question on this axis is whether the ASR leg is limited by the barrier between ops or by op-level parallelism being unavailable at n=3-24. The composite now reports 1.82 of 2 cores, so there is little headroom left in utilisation - which means the ASR's 9.5 s per clip is close to what two A78s can do on 3-column GEMMs, and the only remaining lever is a kernel that makes those shapes fundamentally cheaper rather than better scheduled. That is the same conclusion the shape analysis reached, now with a utilisation number attached.","session_pattern":"this is the sixth and final member of a family: an idea that sounded mechanically sound, cost an hour to build, and measured 0%. Copy removal, thread-partition threshold, per-element division, buffer reuse, activation-quantisation memoisation, and now skinny-matmul scheduling. In every case the change was bit-identical and strictly less work, and in every case the wall clock did not move - because the ASR leg is limited by the arithmetic in 3-column GEMMs, not by how that arithmetic is scheduled. The pattern is itself the finding, and it is why the kernel brief now points at the shapes rather than at the plumbing."}}
