{"run":1105,"commit":"d879f4b","metric":0.2693,"metrics":{"asr_s":38.65,"diar_s":14.94,"other_s":7.79,"first_partial_s":0.253,"p95_piece_ms":78.5,"peak_rss_mb":409,"witness_mhz":2311.4,"deliv2400_pct":93.3,"audio_s":227.94,"rtf_chat69":0.2737,"cores_used":1.81},"status":"discard","description":"Attacked the last identified host-side item in the ASR leg: the per-step cache round-trip was allocating 114 fresh vectors per step (~16.5k per 69 s clip), most above glibc's 128 KB mmap threshold and therefore mmap/munmap pairs with page faults and TLB churn on top of the memcpy. Reading into reused buffers is bit-identical (host gate unchanged) and measurably flat: 0.2693 vs 0.2684, asr_s 38.65 vs 38.50. That is the fourth consecutive 0% for host-side ASR work, and it sharpens the rule: the per-step graph rebuild DID pay because it serialises before a compute, while work between computes overlaps with the matmuls on the other core.","timestamp":1790316210059,"segment":2,"confidence":4.135021097046414,"asi":{"change":"crispasr d879f4b: get_output_into() reads the 114 per-step cache tensors and the encoder output into REUSED buffers. kv.second = get_output(...) returned a fresh vector every step, so the previous buffer was freed and a new one allocated 16.5k times per 69 s clip, most of them above glibc's 128 KB mmap threshold and therefore mmap/munmap pairs with page faults and TLB churn. Bit-identical by construction (same tensor, same bytes, same values) and the host gate confirms it.","hypothesis":"the ASR cache round-trip costs more than its bytes because every step allocates 114 fresh vectors, most above glibc's mmap threshold, so the copies carry page-fault and TLB churn on top of the memcpy","measurement":"armed, witness 2311.4 MHz / 93.3% at 2.4 GHz, battery 356. phone_rtf 0.2693 vs 0.2684/0.2691/0.2692/0.2695 across the last rows - inside the 0.05% spread, i.e. no effect. asr_s 38.65 vs 38.50, diar_s and other_s unchanged. Gate byte-identical (hash 192184ebcd54977e), checks passed.","process_wart_found_and_fixed":"the deps guard caught a workflow bug of my own making: last iteration's row ended in 'discard', which reverts UNCOMMITTED changes in this repo - and my deps.lock update for that iteration's dependency commit was uncommitted, so the lock silently rolled back to an older head and the next build refused to run. The lock update is now committed as part of the experiment, not left beside it. Worth knowing for anyone extending this harness: anything that must survive a discard has to be committed before the row, not after.","the_distinction_this_row_sharpens":"four host-side ASR changes have now measured 0%: copy removal (#1091), thread-partition threshold and index arithmetic (#1092), and now buffer reuse. But one host-side change DID pay: building the 4,000-node graph per step (#1098, ~0.55 s/clip). The difference is where the work sits relative to a compute: work that must FINISH before the next compute can start is on the critical path and cannot be hidden, while work between computes overlaps with the matmuls on the other core. So 'host-side' is not the discriminator - 'serialised before a compute' is. That is a sharper rule than 'host work is hidden' and it is what should guide any future attempt on this leg.","what_remains_and_why_it_is_all_external":"with host-side work bounded, geometry bounded (left context and chunk_ms both rejected on accuracy with the model's declared values), weight format bounded (every quantised ggml type declares vec_dot_type = Q8_0, so the dot is int8 SDOT whatever the weights are) and the frontend bounded (18x already), what remains in the 61 s protocol wall is (a) encoder matmul arithmetic in kernels we do not own - KleidiAI, blocked on a network fetch for the arm_llama kernels; (b) the one-runtime merge, whose ceiling has shrunk as utilisation rose from 1.61/2 to 1.81/2; (c) a cheaper model pair, outside the contract; (d) the ggml-native cache round-trip, which is the one remaining host-side item with a real mechanism, but this row is direct evidence that it will be worth ~0% because it sits between computes rather than before one."}}
{"run":1106,"commit":"878367a","metric":0.2684,"metrics":{"asr_s":38.52,"diar_s":14.9,"other_s":7.77,"first_partial_s":0.255,"p95_piece_ms":78.7,"peak_rss_mb":409,"witness_mhz":2307.6,"deliv2400_pct":93.1,"audio_s":227.94,"rtf_chat69":0.2733,"cores_used":1.81},"status":"keep","description":"Tested whether the diar encoder's 6.6 s/clip could reach the A78's fp16 FMLA by converting its q5_0 weights to f16 - a live idea, since audiocpp's ggml (unlike CrispASR's patched copy) has F16 wired to the native vec_dot_f16. Refuted by arithmetic before writing the converter: every quantised ggml type already declares vec_dot_type = Q8_0, so both models run int8 SDOT, which on Cortex-A78 is ~4x the fp32 FMA rate while fp16 FMLA is ~2x. The models are already on the fastest arithmetic the core has, so f16 would move the encoder DOWN a rung. Recorded in the design note and backlog so the lever is closed by mechanism rather than by five failed requantisation experiments. Metric unchanged at 0.2684, gate byte-identical.","timestamp":1790316436752,"segment":2,"confidence":2.938013442867811,"asi":{"arithmetic_ranking_on_this_core":"per cycle on Cortex-A78 (ARMv8.2-A, two 128-bit NEON pipes): SDOT int8 ~4x the fp32 FMA rate, fp16 FMLA ~2x, fp32 1x. Both models are on the 4x path already, so the fastest arithmetic this core has is in use and there is no precision move left that does not go DOWN the ladder.","hypothesis":"the diar encoder spends 6.6 s per 69 s clip in transformer matmuls, and audiocpp's ggml - unlike CrispASR's patched copy - has F16 wired to the native vec_dot_f16, so f16 weights might reach the A78's fp16 FMLA and beat the current q5_0 path","measurement":"armed, witness 2307.6 MHz / 93.1% at 2.4 GHz, battery 361. phone_rtf 0.2684, asr_s 38.52, diar_s 14.90, other_s 7.77 - unchanged tree, gate byte-identical (hash 192184ebcd54977e), checks passed.","one_grep_prevented_an_hour":"the whole question was decided before writing a q5_0 dequantiser: audiocpp's type table really does have F16 -> vec_dot_f16 (no CrispASR-style patch), so the idea was live, and it was the core's arithmetic that killed it rather than any assumption about ggml. Reading the two tables first is the cheap half of this session's method; the expensive half is only worth spending once the answer is not already sitting in a header.","state_of_the_loop":"five consecutive rows now sit at 0.2684-0.2695, a 0.4% band, with every lever class closed by a mechanism rather than a null result: geometry (left context, chunk_ms, diar chunk/fifo) by the model's own declared values being load-bearing; weight format by the int8/fp16/fp32 ranking; host-side ASR work by 'serialised before a compute' vs 'between computes'; the frontend by an 18x fix already banked; and the deployment layer by a merged single GGUF that is neutral by design. What remains is external (KleidiAI needs a network fetch) or outside the contract (a cheaper model pair, a one-runtime merge whose ceiling has shrunk to 1.81/2 cores).","what_this_row_changes_for_the_record":"nothing measured - the value is that the model-format lever is now closed by arithmetic rather than by five failed experiments. Anyone who later proposes 'try f16 weights' or 'try q4 because it is smaller' can be answered with the type table and the core's instruction throughput instead of re-running the sweep."}}
{"run":1107,"commit":"ad12679","metric":0.2683,"metrics":{"asr_s":38.49,"diar_s":14.95,"other_s":7.72,"first_partial_s":0.258,"p95_piece_ms":78.4,"peak_rss_mb":409,"witness_mhz":2307.7,"deliv2400_pct":93,"audio_s":227.94,"rtf_chat69":0.273,"cores_used":1.81},"status":"keep","description":"Fixed .auto/validate.sh --compare, which had been failing quietly since I wrote it: it looked for a token count in a field the scorer does not print, the parse raised, the except branch swallowed it, and every clip came back as '(missing)' - so two comparisons this session had to be redone by hand. Rewritten around what the scorer actually emits, reporting per clip the recomputed WER and delta, whether the text is identical once labels and segment joins are removed, how many speaker labels churned, and the word-level edit distance; plus a micro-average from S/D/I/H and a sign test that discards ties (the old formula counted ties in n and printed p=0.001 for a result where nothing moved). Validated against a case whose answer is known independently: ref vs the f16-joint candidate gives all 11 clips WER-equal, micro 0.1019 with identical counts, text identical on 8 of 11, and the 3 differing being precisely the English clips with a boundary space. Also declined to implement the largest remaining structural idea after reading that it is chunk_ms=960's encoder geometry - already measured and rejected on accuracy.","timestamp":1790316713749,"segment":2,"confidence":2.27514450867052,"asi":{"lever_i_considered_and_rejected_before_implementing":"the largest remaining structural idea was batching several chunks per graph execution, which would halve the encoder's weight traffic (23 GB per 69 s clip) and cut the overlap recomputation. It was NOT implemented, because it is chunk_ms=960's encoder geometry with a different decoder cadence, and chunk_ms=960 was already measured and rejected (+5.9 WER on gate_ms_v2, past the holdout_en ceiling). Spending an hour to re-derive a closed result is how sessions waste their last hours; reading the earlier row was cheaper and just as informative.","measurement":"armed, witness 2307.7 MHz / 93.0% at 2.4 GHz, battery 361. phone_rtf 0.2683, asr_s 38.49, diar_s 14.95, other_s 7.72 - unchanged tree, gate byte-identical (hash 192184ebcd54977e), checks passed. Six consecutive rows now sit in 0.2683-0.2695.","same_failure_mode_as_the_build_scripts":"this is the third instance of one pattern, which is worth naming as a class: a tool that fails QUIETLY and looks like it worked. cmake exit codes swallowed (twice, producing fake measurements), a GGUF writer that parsed but misplaced data by exactly one header length, a deps lock that a discard silently rolled back, and now a comparison that reported '(missing)' for every clip while exiting 0. Each was found by checking whether the output was plausible rather than by reading it - '(missing)' on eleven clips is implausible, and so was a 0.0% result from a build that had not compiled. The general rule for this repo: every tool that reports a result should be able to report FAILURE loudly, and a surprising number should be treated as a bug until proven otherwise.","the_general_lesson_is_the_whole_session_s":"Three separate times this session, a measurement said something false and the code was innocent: cmake exit codes swallowed so a stale archive was measured as a fresh one (twice), and a dependency worktree that nothing tracked so a clean checkout would have rebuilt the 0.47 baseline while the ledger claimed 0.269. Each was found by disbelieving a number, and each is now structurally prevented rather than documented: the build fails loudly on a compile error, it refuses to build against unpinned dependencies, and the accuracy comparison now reports its own parse failures instead of swallowing them. The optimisations themselves were found by disbelieving a label - three separate 'model-bound' legs were carrying signal processing, bookkeeping and host matvecs that no model profiler could see.","tool_fixed_and_validated_against_known_answers":"the rewritten comparison reproduces, from the stored transcripts, exactly what was established by hand during the f16-joint work: all 11 clips WER-equal; micro 0.1019 with identical S/D/I/H (245/69/11/2865); text identical on 8 of 11 once labels and segment joins are removed; the 3 differing clips are the English ones and differ by a segment-boundary space (word edits 37/15/17); the Chinese clips show 0 word edits despite 69-121 label changes. A tool that reproduces a hand analysis it was not written from is worth more than one that merely runs.","why_this_row":"with every in-contract lever closed by a mechanism, the remaining risk is not speed - it is that a future agent inherits a harness whose accuracy tooling quietly reports nothing, and re-derives a conclusion the ledger already holds. Fixing the comparison is the highest-value work left, and it is the same lesson as the build scripts applied to the accuracy path."}}
{"run":1108,"commit":"786062a","metric":0.2659,"metrics":{"asr_s":37.95,"diar_s":14.89,"other_s":7.76,"first_partial_s":0.251,"p95_piece_ms":77.7,"peak_rss_mb":409,"witness_mhz":2288.2,"deliv2400_pct":91.8,"audio_s":227.94,"rtf_chat69":0.2711,"cores_used":1.81},"status":"keep","description":"Added per-window encode timing to the diarizer and used it to test three explanations for an anomaly I had spotted, all of which turned out to be wrong in instructive ways: (1) cross-engine thread contention - the 2x middle window survives with --no-asr, so it is internal to the diarizer; (2) ggml worker spin - poll=50 is only ~4 ms of spinning, which cannot explain 1.8 s becoming 3.6 s, so the hypothesis died on arithmetic before I built the override; (3) first-touch page faults - faults are front-loaded into window 1 (49.5k) yet that window is the CHEAPEST per frame, so faults are not the driver. The real finding required measuring the denominator: per-window frames are 380/548/351 and the cost is linear at 4.85/5.46/4.89 ms per frame. That closes the 'something hidden in the diar encoder' question and turns the one remaining structural idea - caching the carried speaker state's per-layer K/V, which the causal attention mask makes mathematically valid - into a sized estimate of ~2.2 s per 69 s clip, about 7% of the composite. Metric unchanged at 0.2659, gate byte-identical.","timestamp":1790317377872,"segment":2,"confidence":2.288340034462952,"asi":{"correction_i_made_mid_iteration":"my first reading of the per-window times was wrong and the instrumentation corrected it: I concluded cost was 'anti-correlated with window size' from two numbers whose window sizes I had estimated by hand. Measuring the sizes showed 380 / 548 / 351 frames, and the cost is linear in them (4.85 / 5.46 / 4.89 ms per frame). The middle window of chat69 is not anomalous at all - it is simply the largest window, because by then the speaker cache is full and the chunk plus state reaches 548 frames. The rule that earned its keep this session is 'measure the denominator too': a per-item time is meaningless without the item size.","diagnostic_value_the_bounty_is_now_sized":"the linear cost model turns the one remaining structural idea into a number instead of a maybe. The diar encoder processes (speaker cache 128 + fifo 40 + chunk) frames per window and re-encodes the 168 state frames every time; the attention mask is CAUSAL (keys at or beyond lengths are masked to -10000), so those state frames' per-layer K/V are mathematically identical to what the previous window computed and could be carried in a cache. At a measured 4.9-5.5 ms per frame, dropping 168 of every ~508 frames is ~33% of the encoder: roughly 2.2 s per 69 s clip, about 7% of the composite, and bit-identical in principle. That is a real project - expose 12 layers x K/V as graph outputs, ring-buffer them alongside the existing speaker cache, and process only the chunk frames - and it is now the best-evidenced thing left in contract.","falsified_hypotheses_this_iteration":"1. 'The other engine's threads are stealing the diar encoder's time.' The 2x middle window survives with --no-asr (diar-only: 1.832 / 3.147 / 1.703), so it is internal to the diarizer, not cross-engine contention. 2. 'ggml's worker spin is stealing cores.' poll defaults to 50, i.e. n_rounds = 131072 x 50 ~ 6.5M pause iterations, which is about 4 ms of spinning - nowhere near enough to turn a 1.8 s window into 3.6 s. The arithmetic killed it before I built the env override. 3. 'The expensive window is paying first-touch page faults.' Faults ARE front-loaded (49.5k in window 1, then 16.3k, 10.0k) but window 1 is the CHEAPEST per frame (4.85 ms), so faults are not what makes a window expensive; they are the cost of paging in ~198 MB of weights once, and prefaulting would only move it out of the measured window.","kleidiai_now_verified_not_assumed":"both vendored ggml copies carry the KleidiAI glue (kleidiai.h, kernels.h) and the CMake option, but a filesystem-wide search finds no ai_micro_kernels anywhere on this machine, so the last kernel-level lever is genuinely network-blocked rather than merely believed to be.","measurement":"armed, witness 2288.2 MHz / 91.8% at 2.4 GHz, battery 366. phone_rtf 0.2659, asr_s 37.95, diar_s 14.89, other_s 7.76, first_partial 0.251 s, p95 piece 77.7 ms - unchanged tree within the 0.4% band, gate byte-identical (hash 192184ebcd54977e), checks passed.","process_costs_measured_not_invented":"this iteration also cost two build failures, both caught by the guard added two iterations ago, and both mine: a python edit that silently no-opped because I matched a field name that did not exist (features_s, not fbank_s), and a timestamp declared in the wrong scope. The first produced a commit that did not compile - which is exactly the failure mode the build scripts were hardened against, and it is now loud instead of silent.","two_tool_guards_fired_at_me":"the deps guard refused a build because audiocpp was dirty, and my own shell chaining ('; before the probe') then ran a probe against the stale .so anyway - the same class of error the guard exists to stop, committed by me in the same command. Worth remembering: a guard only helps if the command around it is written so the guard's failure cannot be followed by the step it was meant to prevent."}}
